title,x,y,cluster
About the 🎈 Using Streamlit category,-46.84212,-34.477795,9
Using Streamlit: how to post a question in the Streamlit forum,-40.23892,-27.896046,9
Saving data in local storage via streamlit,-30.54255,-3.2896817,9
Problem with multiselect erase button,90.17424,-11.138851,7
Problem saving number_input in a list,62.305904,8.357763,5
Update st.bar_chart using st.sessionstate and multiprocessing,8.114463,-75.27843,2
"The application runs for a minute and gives an error ""Oh no. Error running app""",-17.244383,54.937313,1
Need click twice on button for changing state,32.397465,42.924953,0
Streamlit not recognizing module from same package,-75.05856,-14.308951,9
Streamlit st_pages session state issue,-53.061832,8.461734,9
CSV Download from Data Frame fails if hosted in Cross Origin iFrame on Chrome and Edge,-1.4478251,-4.747234,8
Streamlit login and mutipages,-59.770332,6.6016006,9
Problem with iframe height,4.567669,-19.456995,4
"How to set up ""Allowed-message-origins"" in config.toml file?",-73.794754,55.803925,1
Configuring Apache 2.4 for proxy,-67.0007,-23.274368,4
How to add custom HTTP headers?,2.8619564,-2.0105703,4
"Text_input : how to disable ""Press Enter to Apply""",51.47142,28.262808,5
Spinner doesn't show and then everything updates once the task in the spinner completes,7.1854606,7.7865725,2
Multi-user chat application,33.417847,11.78139,2
Streamlit hello results in 404 error in bespoke environment,-64.154724,-10.176507,9
Data privacy/data protection (for uploaded files),-23.092262,70.4357,6
Transformers module not found,-65.17728,30.771782,1
Blank Page after adding login to Streamlit Please help am new to it,-40.333588,-14.786865,9
Exception only when Debugging in VSCode,-10.653489,33.969753,1
"""oh no"" Error running app",-17.50864,54.767593,1
Rebuild all changed files,-12.237076,67.74618,2
Double entry accounting sandbox,0.37152165,3.1950536,4
Cannot see stack traces,-16.421001,38.373257,1
Change of color for Navigation bar,31.824938,-25.888765,4
Keep DataFrames objects between sessions in a thread-based program,41.589363,79.12202,2
Style Column Metrics like the Documentation,38.586876,-34.797085,4
St.chat_message enter does not post,37.294804,17.072569,5
Streamlit app not getting deployed,-65.85645,-2.2250528,9
CSS Hack: Add Icon to Streamlit's date input,-9.01034,-54.089985,9
Sidebar menu items have different indentation if there is a markdown with link tag,42.39998,-2.4331608,4
Checkbox status after click,77.7564,38.146107,0
Insert calplot heatmap in Streamlit,-20.483105,-67.90337,9
Has somebody solved the session_state.messages error?,34.517025,77.02128,1
Checkbox doesnt work inside if condition,78.15956,37.65107,7
Streamlit app not being deployed,-65.87969,-2.2240338,9
TeachableMachine multiple image labels deployment in Streamlit,-36.35582,-54.119728,9
How to implement a three-column layout in chat_input,36.7738,13.138658,5
Not able to make streamlit work on AWS EC2 with Ubuntu 22,-68.74477,3.6739275,9
Streamlit-trubrics Platform show user score_feedback=None after submitting,-56.725994,-22.741352,9
Remove streamlit welcome message on Windows,-32.9034,-9.442823,9
Altair mark shape,2.4763234,-92.953445,4
Support run from witihin python,-80.27242,-25.371489,1
Question about scroll event,35.812057,1.6854761,4
Analytics not working,-2.3457408,21.863028,1
Perform insert operation using st-gsheets-connection in private sheet,-9.46869,-9.607223,5
Problem with List.pop() breaking the text_input component,57.273556,22.000774,5
Multiprocessing leads to frequent app crashes,-67.11847,-38.99848,1
Count of variables in column for multiple lines on st.line_chart,11.595909,-81.125626,3
App reload cause?,9.782292,55.96524,2
How to display st.markdown in a column of st.dataframe?,42.373787,-66.3781,8
Change the progress bar background color,28.615524,-37.484608,4
Model size too large?,43.165756,-13.914794,4
Drag and Drop / pdf file / streamlit,-5.0316424,-30.670126,9
Error when updating streamlit,-57.424,-8.151386,9
Streamlit fails to run,-60.731457,-13.118202,9
Anyone creating business-facing apps with Streamlit?,-42.747734,-34.28696,9
Run streamlit from PyCharm,-82.48841,-28.604174,9
Subject: Streamlit: Dynamically Updating DataFrame and Scatter Plot,-8.0822525,-60.925365,3
What is the scrolling event streamlit,-13.924871,-23.996502,9
Change Background of Streamlit Container,-23.450928,-45.488297,9
My multi_select and plots disappear when i choose and ID,91.20231,-4.020896,7
You need to enable Javascript to run this app！！！,-22.268957,57.926464,1
I'm curious about the OpenAI keys in the Streamlit apps on Share App,-43.567562,-32.042187,9
How to block message asking for user email on first use,1.096636,38.254555,2
File uploader dropdown related issue,-36.720493,73.791405,6
Pop-up in the label of streamlit.slider,-17.406487,-18.485615,9
Adding scrolls bars to expander is not working,66.15617,-18.525915,4
St.chat_input interaction with other menu option component,38.41478,15.540504,5
Modifying a column based on 'is_widget' value,59.323986,44.92329,5
How do I enable/disable a widget based on a toggle click using session state?,53.349773,55.186924,2
Saving Unique Data to different pages,20.09552,36.51909,2
How can I make the application automatically load the historical input value of the component?,32.873802,23.401289,2
This sends a error message for streamlit app for requirements (this should not),-61.067265,-9.910397,9
How to get click action in a text,21.92836,-19.527218,0
Selenium Webdriver error,-37.34286,41.415405,1
Updating column value based on data_editor input,54.13166,-43.524944,5
Obtain data using st.form and st.checkbox,78.843765,33.66034,5
"Ubuntu, Streamlit 1.29 : enable javascript to run message even for helloworld with curl",-30.09923,-33.338844,9
Google Authentication in a streamlit app,-62.53236,7.0477123,9
Inconsistent decimal separator in st.number_input,61.500225,3.8006175,5
App suddenly not working?,-19.093693,58.062645,1
Chatbot component,32.847527,12.909828,4
Nginx setup WebSocket connection error with a subdomain name,-79.10632,39.38197,1
How to export st.markdown() content as it is shown on the app,21.736237,-11.833184,4
Prevent page from refreshing with multiple buttons,20.162146,42.996822,0
Bokeh DataTable,-48.097237,-73.30383,3
Icon as button,28.606567,19.576832,0
Multi-text input is awkward with too much extra space,44.90796,-11.457217,5
"Getting an error ""'streamlit' is not recognized as an internal or external command, operable program or batch file.""",-66.76709,-14.991628,9
Increase the size of tooltip icon,26.666761,-22.858564,4
Custom fonts didn't work streamlit version 1.27 above,-8.480975,-48.485374,9
Streamlit application runs multiple times on startup,-47.621326,-12.949749,9
StreamlitAPIException: set_page_config() can only be called once per app error,-19.588636,-13.173438,9
Adding more images with button clicks,19.413994,-25.948431,0
"Streamlit Pages, hide the collapse expander",-12.283645,-33.489346,9
Embed iframe to my website,2.4894216,-19.836433,4
Modify st.chat_input via CSS,37.55855,13.966829,5
How to import a module from a parent directory in a Streamlit project?,-76.47868,-14.477412,9
Cannot keep float number from st.data_editor,55.652775,-47.004665,5
"Re-Run/Refresh does not update page anymore on 1.24.0, need restart of Streamlit for update to happen",-30.76506,-13.556453,9
Cannot change matplotlib figure size,-11.12014,-68.41776,3
How to remove analytics.js load?,-2.6718612,22.667362,2
Display streaming response that may have Latex,-25.04846,-36.175117,9
Custom customization of the button is not working,31.290026,27.151413,0
How to bring the user to a specific tab within a page in my multipage app using the URL?,17.829933,24.893269,4
How to add dynamic tags to a column in Streamlit data_editor?,-7.7183013,-42.732788,9
Unable to open webcam in Streamlit in cloud envirement,-41.41166,2.0295343,9
Streamlit does not use venv,-59.087982,-17.054436,9
App in local host not detecting change in source code,-29.122166,59.36349,1
Error after deploying(Streamlit server consistently failed status checks),-67.5829,-4.7509284,9
Cannot preserve the selections in multiselect,90.79181,-13.233093,7
How to have API call on streamlit?,-43.43733,-28.687641,9
How to Refresh Radio Button Options,83.711395,22.548765,0
Multiuser Issue in Mulitpage app,11.361882,29.818287,2
How to dynamically create a number of columns and insert an element into each,56.293137,-23.21191,4
Reset slider values to original state,77.82662,-30.43826,2
Increase expander's label text size,69.6045,-16.759626,4
Inconsistent behaviour of st.selectbox with sessions,96.96948,-0.088053584,7
How to display st.chat_input() widget in different locations other than the bottom of the page?,38.032204,13.860993,5
How to get analytics data from you SL app connected to Firebase,-1.1934941,22.672169,2
Custom font with streamlit extras,-8.9115,-48.1126,9
Unable to launch Streamlit app,-54.47156,-8.676633,9
Changing the Avatar,9.162283,-9.233397,4
Unable to update Streamlit app after GitHub update,-57.03956,-7.407839,9
CEL with StreamlitChatMessageHistory.,-37.03653,-34.067505,9
MSODBCSQL18 Streamlit Cloud Connection Error Does Not Recognize ACCEPT_EULA,-70.306564,-6.670596,1
Unsafe_allow_html for all widgets,-0.2017719,12.3604145,4
ModuleNotfound error,-63.38809,33.349678,1
Google authentication with Streamlit Community Cloud,-62.711784,6.9324894,9
Double clicking on the codesection in the docs causes whiteout,-23.213507,29.378914,1
How to prevent submit from text_input widget when enter key input?,51.832493,28.549711,5
Want to know how to embed my html code in the streamlit currently facing alignment issue and responsiveness of the webpage with the streamlit,-23.80526,-32.41393,9
Anyone using the new features from openai?,-43.333183,-31.813768,4
Custom Fonts on Streamlit,-8.783461,-48.036396,9
Streamlit App Engine Google Flex slow/not responding,-52.39392,-10.974025,9
Hover over selectbox: display current selection text,85.31347,-4.9525943,7
Arbitrary option,82.89221,11.812288,7
"AttributeError: 'DataFrame' object has no attribute 'append' when using st.session_state""",43.360023,79.22199,8
Passing Django Usernames to Streamlit,-89.38241,-23.985722,9
Hide pages using multipage,15.984051,20.702583,4
Navigate Multipage App with Buttons instead of Sidebar,20.974066,24.207941,4
St.chat_input bug,38.045036,17.099451,5
How to remove progress bar,28.026379,-37.529324,4
How to upload a pdf file in streamlit,-23.113285,-0.4159725,9
How to wrap text in Streamlit data_edit?,-8.544274,-43.088573,9
Move text to absolute top of the page,36.52483,4.861536,4
Print not works with steamlit on debian system,-60.549114,-25.690304,1
Connection to local Postgres - 'utf-8' codec can't decode byte 0xe3 in position 98: invalid continuation byte,-43.81424,58.647614,1
"First click on button inside a tab not working, needs a second click",18.63818,12.280079,0
Custom sonwsight,-9.963684,-49.0998,4
Click twice on button for changing state,32.406258,42.94049,0
Pyttsx3 error in streamlit,-63.794647,-14.958345,9
Button Positioning at any coordinates on an image,21.00504,-25.27135,0
SCAMP and Streamlit,-44.786053,-40.935165,9
UnboundLocalError: cannot access local variable 'text' where it is not associated with a value,-43.544838,29.422323,1
How to use Streaming response to a container WITHOUT using LangChain (AWS SageMaker Endpoint),-70.813095,4.6089983,9
Text_input / chat_input set text programatically,40.61802,15.317394,5
Chat input widget. (st.chat_input) Error Message,38.431393,17.912764,5
How can I debug streamlit killed crashes?,-54.61023,-11.694994,9
Using for loop in tabs but loading data don't update,21.538784,10.365515,2
Filter dataframe error,51.82311,-57.55228,8
What are the conditions or steps one needs to fulfill to have their work showcased in the Streamlit Gallery?,-46.529503,-42.466366,9
Streamlit Chatbot trained on own dataset no longer working,-12.1840925,-15.51612,9
ModuleNotFoundError: No module named 'streamlit_extras.add_vertical_space',-73.26078,-16.563051,9
Is there a way to set unique key for widget inside a dictionary in session_state?,56.64318,57.25859,2
Preserving state across sidebar pages,47.489117,1.3924457,4
TypeError: bar_chart() got an unexpected keyword argument 'x',1.0163978,-82.41927,3
Run Cron Job in streamlit applications,-67.928894,-26.250586,9
My CSS styles is not loading in the component. I may quit,9.178859,-14.196938,4
"St.multiselect label doesn't work with markdown, doesn't parse",92.83176,-15.2502985,7
Streamlit on Windows IIS hangs without starting app (or starting all of Streamlit?),-53.278374,-11.755889,9
"St.image() not working, returns a DeltaGenerator() object",-22.979996,17.13296,1
Please help a confused guy with Streamlit/DataFrames/Filter - Updated,5.1523857,-47.465836,8
No such file or directory:,-55.22439,59.26911,1
PyCharm debugging instructions does not work in Windows environment,-83.85224,-29.64676,1
Issue with auto-saving st.text_area that scrolls to top on every edit,39.69046,7.8453913,5
How to resolve Error installing requirements?,-74.99882,26.252775,1
Streamlit Flow interactions,-46.11812,-46.301826,9
Having problem's with os module compatibility with streamlit app hosted,-67.34777,-7.6535063,9
My python is not deplyin streamilt,-73.66315,-24.879217,9
Create a clock/timer with streamlit tools,-56.06478,-36.642475,9
"KeyError: 'st.session_state has no key ""$$GENERATED_WIDGET_ID--None"". Did you forget to initialize it? More info:",55.040367,58.63079,1
Config.toml not being used in Google Cloud Run,-71.25009,55.217552,1
Streamlit cloud with Pyomo and IPOPT,-75.24664,-36.917587,9
Upload images and display it later with image url,16.814611,-17.63034,6
Selectbox Scroll,86.38821,-2.3194902,7
IndexError: list index out of range,-40.606037,24.652098,1
Thousands Separator in a Number Column of Data Editor,58.34471,3.482023,5
Any news how to get user clicks on chart?,4.7801237,-67.77976,3
"Dynamic bar Map, update map instead of re-render",15.002591,-55.429794,3
`st.plotly_chart` not render properly until an rerun while using `secondary_y` to overlay density curve to histogram,-10.284204,-82.767296,3
Expandable tabs in sidebar,48.18629,-7.697018,4
Creating a golden ratio template for Streamlit apps,-41.12089,-39.84539,9
Function sticking cause of session_state not clearing on page reload or browser tab close,31.04213,72.242134,2
"I have a loop inside a thread which should display 2 warnings, but it displays only one",3.0666335,20.943708,1
"Redirecting python stdin to a ""text input"" widget?",58.60331,33.300766,5
Streamlit - Best Practices!,-48.674118,-40.121902,9
Filter dataframe by selections made in select box,53.753105,-55.99298,8
Finally I find a right way to use extra-cookie.manager!,22.00537,70.51958,2
Streamlist - Clear screen on action,-44.449966,-17.730211,9
Streamlit and DataFrame Output - Options aren't showing up,2.3651783,-45.990753,9
Dataframe was not working,35.305984,-57.845116,8
"Super simple streamlit app reruns on start (side/effect), not clear why",-47.83845,-11.8850975,9
How do I use a background image on streamlit,-24.110493,-45.440277,9
How to update the DF(st.data_editor) being shown?,55.65021,-44.74882,8
Multiselect widget not working as expected inside streamlit form,-0.2846247,-30.649824,7
Adding new row to editable tables,57.633778,-7.290408,5
Embedding refresh avoid,13.932039,41.386517,2
How to create click events?,21.34037,-20.00296,0
Called in wrong state: stable when using webrtc_streamer,-46.079254,2.7232664,9
I couldn't delete my project since delete is passive,-20.76442,63.737576,1
Sql delete,54.896973,-37.41785,5
Align to the right,41.43872,-20.639723,4
Reducing the size of audio file created using audio-recorder-streamlit component,-29.430984,7.5949697,9
Recalculate columns values in a st.data_editor only works with first row,53.678577,-44.20972,8
Changing the chat_input width,37.322124,13.654735,5
How to avoid sidebar getting refreshed automatically,47.32461,-3.0044081,2
Predict numeric outcomes from user's input values trained using pandas excel datafram,42.46407,-48.477608,8
More icons other than emojis,27.310007,20.563105,4
App is not booting anymore,-18.482983,57.939964,1
Parquet vs Feather,-57.334576,-16.70753,4
On click custom component,34.38531,23.101612,0
Next js or Streamlit,-29.79171,-34.31458,9
What should someone take into account when building a live streaming streamlit app?,-43.504658,-35.256176,9
ValueError: The truth value of an array with more than one element is ambiguous,-42.02843,26.764616,1
How can I increase the height of table rows in st.dataframe?,44.40263,-65.39863,8
Displayed dataframe is visually shaking,30.42872,-59.483784,8
My app disappeared,-19.535,59.659378,1
"Have to feed the textbox input twice , Earlier it was working piece of code",56.005936,14.684918,5
Filter st.multiselect doesn't show dataframe,55.73854,-58.004692,8
On_click for links/hyperlinks; session_state preservation for complex apps,37.722565,61.95299,2
Streamlit-Folium Issue: Implementing a refresh button and retaining center and zoom locations,-17.33216,-49.279747,9
Error deploying on the cloud,-34.852634,49.70001,1
ImportError: cannot import name 'AxisInt' from 'pandas._typing,-10.639151,-64.077515,8
"Define ""spawn point"" for a map?",13.003355,-57.731407,4
Lost edit access to streamlit app deployed in cloud,-61.348698,-3.5493522,9
KeyError: 0 with bar chart,1.0006464,-82.435844,3
Cloud front ssl with streamlit,-63.647312,18.186304,9
Freezing on initial execution at email prompt,-4.0743814,61.728058,2
How to put a Plotly graph inside a box shape?,-14.237233,-84.60675,3
Read png from s3 using st.connection,-29.728334,19.785055,6
St.plotly_chart shows small gap between the axis and chart,-8.511463,-82.456726,3
Runtime error when importing FAISS,-57.168125,37.471214,1
Blank page,-9.704624,29.770489,1
"Folium Map not rendering properly, OrderedDict mutated during iteration",-15.764307,-51.93939,3
Customize the streamlit sidebar navigation collapsed and expand button,-12.902072,-34.538284,4
Issues connecting Streamlit features (st.multiselct) to real data (.csv),1.7887737,-30.5383,9
Creating stock price monitor,11.179289,-73.95185,4
Pay wall for streamlit content,-39.028397,-33.52489,9
Streampit application runs multiple times on startup,-47.64118,-13.055627,9
A way to reatin data_editor state across pages,56.17627,-42.664433,2
Hide pages in Multiple pages app,15.835246,21.154547,4
How do I align elements in differnet columns?,50.805424,-19.794645,4
"Strange Exception ""StreamlitAPIException""",-71.470436,-46.630028,9
Error when switching between pages in app,18.725395,26.45495,1
Making markdowns disappear automatically,21.01839,-10.039458,4
Multiple Sessions Issue with Supabase Auth,-2.2295737,57.107452,2
Click on row in dataframe and navigate to a detail page for the row clicked,31.894487,-49.462543,8
Trigger function from an st.data_editor,55.57794,-43.33873,5
Interactively harnessing the selected vertical span (the start and end x-coordinates ) in an audio (speech) plot,-32.801598,10.507034,3
Is it possible to have an app bar at the top of a streamlit page?,-14.103108,-34.105083,9
StreamClosedError & WebSocketClosedError,-80.22963,37.86528,9
Mito on Streamlit,-43.410034,-38.869297,9
Error after successfyllu deploying and running the app. No module named 'st_paywall',-28.998566,51.69731,1
How to create on click events,21.282276,-19.973757,0
Redirection if response data has the link,23.660696,32.65159,2
Add Image and header to Streamlit dataframe / table,0.33110005,-43.532036,9
How do you clear the input box after hitting enter?,53.846703,29.22848,5
St.empty() doesn't work,22.772858,3.8390052,5
Hiding thoughts entirely with Streamlitcallbackhandler,-42.777134,-22.345907,9
Selectbox has different style using localhost or IP address,81.55715,-2.361567,7
Streamlit deployment with Docker - local works but K8s `You need to enable JavaScript`,-83.57219,7.1002517,9
`st.cache_data` `func.clear()` clear data associated with specific argument(s),4.334453,72.79307,2
Columns nesting workaround,53.52941,-23.760973,8
Disable spinner from google sheets library,6.6356626,7.2996745,4
Long Anchor Tag Generation,12.579903,7.4659743,4
How to hide the new download button from st.dataframe,-11.185706,9.689486,8
Running a IIIF server in Streamlit,-51.060955,-38.908226,9
How to disable sorting of columns while using St.dataframe?,34.77408,-52.67885,8
Adding a long PDF as a custom data source,-20.15442,-1.1679568,6
Gio: http://localhost:8501: Operation not supported,-29.241022,47.853817,1
Reusing code in columns,54.769928,-25.125587,8
Sizing Custom CSS Block to Parent Height,45.404438,-19.31525,4
Placeholder in a form 'cause of st.radio - having trouble with submit_button,82.29037,19.506466,5
Resetting session_state during page transition,39.485382,71.20261,2
How to create kpi metrics in streamlit,-23.242409,-51.06347,9
"Download, Search and Expand hover in st.dataframe",30.564842,-47.871708,8
Pls help me appreciated github id（https://github.com/AbdukeramDolkun/detectstuff/tree/main/YOLOv8-streamlit-app-master）,-45.558052,7.73673,9
How to create a History Messages of User (Sidebar),29.836481,1.4154732,4
Record audio and save it locally,-28.795982,8.272598,6
How to change the position of st.form_submit_button?,49.843227,35.840054,0
Click checkbox once and unchecking it and clikc again causes the data to be preserved,80.38351,38.970566,7
tradingview widget code help,64.28831,43.881187,4
ColumnConfig - Columns width when displaying a dataframe: automatic resize issue,46.54393,-63.66206,8
Button callback function is unexpectedly executed upon page load,38.524612,43.93297,0
Filter dataframe with st.multiselect based on column that contains array,55.26362,-57.95963,8
St.connection：how to hide spinner writing: Running sql.query(...). in page,7.068476,6.6284018,2
Streamlit APP worked before and now crash -- import tensorflow,-74.01254,-8.272255,9
Sidebar layout change,42.63373,-6.5596094,4
Streamlit app keeps reseting with error,-48.903267,-10.55305,9
Unable to locate wkhtmltopdf path in Streamlit app on Streamlit.io,-67.056,-17.415533,9
Individual category dropdown for each row of data editor,50.74782,-39.9404,7
Using selectbox / multiselect box unable to select a value,87.9459,-6.0778356,7
ODBC Error,-33.455143,35.493595,1
Having column issues when importing a .csv file for st.dataframe,38.83659,-57.53651,8
How to pass header (token) in a streamlit (file_uploader) request?,-54.388863,15.755157,6
Dynamically open multiple pdfs files in different tabs,-9.416565,-4.5044255,6
App deployment error in streamlit,-66.67398,-2.4268367,9
Supabase Google Oauth,-2.6766489,56.717857,4
Simplest way to deploy a streamlit app in Windows server 2012,-63.666912,0.3910237,9
"How to change ""Please wait"" message to something else?",-2.435767,36.961197,4
Resizing sidebar scrolls page to the top,40.783955,-4.471457,4
Pydantic validation error azure api connection,-68.061844,21.32969,1
"[04:43:28] ❗️ The service has encountered an error while checking the health of the Streamlit app: Get ""http://localhost:8501/script-health-check"": EOF",-76.71958,2.3437316,9
Clicking on button refreshes page and forces scrolling to the bottom,34.28326,3.809652,0
Streamlit multi users,-44.06255,-25.34772,9
Display the 2nd page from a link in the search result in the current output of Streamlit,-22.038664,-20.675777,9
Interactive matrix,10.973029,-64.41039,4
Anyone tried to install Streamlit in Alpine Docker image?,-84.62632,8.494549,9
St.file_uploader - AxiosError: Request failed with status code 403,-76.22406,41.580654,6
"Hi guys, I’m trying to get a terminal output to be printed in Streamlit.But its not printed in streamlit",-60.396614,-25.18843,9
Assistance Needed with JSON Content Not Displaying in Streamlit App,-55.17165,-0.45280948,9
Possible to link to element within the same app?,23.818344,27.756502,4
Uploading and using database with file_uploader,-41.261356,70.98433,6
Streamlit Secrets in the the app,-43.895733,-32.46403,9
"Help:when i use “os.system(command)”to run app instead of on terminal ,why the website opened several times(equals the number of python files)",-51.445904,28.117783,1
Checkbox dynamic true and false like toggle on / off,76.70701,38.781418,7
Concurrency question,-47.261753,-26.369593,2
Toml file can't connect with python file,-70.083115,53.115704,1
St.session_state deletes on refresh,37.899952,73.26733,2
How can I learn what Page I am looking at,17.197668,34.640236,4
Reset/delete widgets state on selection of another one,54.737923,50.818142,7
Issue with Coloring Buttons in Streamlit,-15.801054,-29.172361,9
PNG image loses quality when width is reduced,20.481823,-40.030174,4
Translating st.cache allow_output_mutation=True for new cache_data & cahce_resource functions,-4.0849843,86.64639,2
Execution of Code after user presses a button and inputs an URL,41.849487,44.53238,0
"Unable to use text_input form validation without form_submit_button show ""Missing Submit Button""",47.984463,36.1309,5
How to manage a python file with functions,-17.325033,26.121073,6
Session_state seems to be dropping some data,36.64533,70.910225,2
Retrieving the user's sort of dataframe editor,43.579567,-49.69295,8
Trying to access LFS in streamlit through github URL but it's giving me this error,-57.367554,0.53756464,9
Prevent chat from auto-scrolling when message is sent,34.83593,16.7051,2
Extracting selected st.column_config.CheckboxColumn,62.065685,-34.143406,7
Assertion key error,-39.819317,34.402374,1
My app resets when i click a button,27.700262,45.732407,0
Downloading a MS Word document,-7.097726,9.923649,6
How to use `st.experimental_user` out side Streamlit Community Cloud?,-64.1038,-17.739342,9
How to prevent re-run after removing url query params using experimental_ set_ query_ params()?,14.048395,66.01887,2
