title,x,y,cluster
How to create a `add filter` button which creates a new set of fields everytime it is clicked,61.907078,16.2515,0
Issue with st.cache_resource() - Widget state getting collapsed,13.62833,84.37433,2
Which syntax should I follow establishing a SQL connection?,-12.571837,46.881924,1
Please write a login code for multiple pages,-0.4664874,50.010468,2
Query database and display conditions after form submission,66.433754,23.987902,5
Pop-up window on streamlit,-16.678347,-18.605341,9
How to integrate powerbiclient and Streamlit with QuickVisualize,-40.28079,-44.470924,9
Whether there is a layout container can contain streamlit_chat.message,-10.208831,-17.860092,9
Drag and drop image,-4.488494,-30.199913,4
Moving text_input to the bottom,38.401318,11.255168,5
FileNotFoundError (Works perfectly fine for a pdf file imported the same way),-53.691822,62.161118,6
Unable to upload image logo,-35.659058,71.5254,6
Safety issues with exec or subproccess,-15.112829,39.480457,2
Streamlit cannot not change theme with config.toml file,-74.66918,50.23658,9
Unable to see logs for bad request,-10.976068,37.663185,1
Wide mode not working,39.04917,-12.022719,4
Can you use Streamlit elements in a custom component?,-27.37644,-38.578568,9
"Error: Unrecognized type: ""Duration"" (18)",-29.915194,35.172684,1
Showing Percentage in AgGrid,14.552346,-43.597656,4
"Disable buttons, checkboxes and other widgets during code execution",52.6894,47.506218,0
Unable to load m4a files with librosa.load() in streamlit run,-59.89445,-12.555583,9
UI Unit Testing Streamlit Apps--best practices?,-50.08361,-21.33067,9
Activating Streamlit affects progam functionality,-55.194176,-20.759304,9
Streamlit displays always content of not selected page,-39.16708,-15.727004,9
"HELP! UserWarning: Matplotlib is currently using agg, which is a non-GUI backend, so cannot show the figure",-12.403532,-67.27011,3
Keep information despite a app refresh,9.083075,57.98036,2
Passing button callbacks from view to controller (MVC),45.784443,42.4881,0
Anchor tag,12.613088,7.5533514,4
What is a difference between an `if` block and `on_click` for a button?,35.627422,45.65371,0
Organic Slider Method?,80.34467,-35.753857,4
Hide titles link,14.0809355,9.551514,4
Pretty Dataframe - Which components?,34.211655,-64.321915,8
Trying to make a image slideshow,17.970835,-33.500748,4
Managing error in callback function with form,45.25069,47.950687,5
How to print,13.6308,3.5370014,4
Reset st.text_input field,54.25666,25.429794,5
Usage of api.segment.io in streamlit,-43.87814,-29.536373,9
Installing Streamlit using Anaconda and running it in Windows 10,-91.9502,-2.2532566,9
I don't see button,34.954758,34.780186,0
"Streamlit Froze at ""Please wait...""",-51.785522,-14.31137,9
Streamlit generated URLs doesnt work,-40.774933,-11.143472,9
Force Reload of Webpage,17.445814,42.688293,2
Image next to name for radiobutton option*,86.79521,25.264626,4
St.form - rounded shape,62.464466,24.220516,4
Streamlit_authenticator :got multiple values for argument 'cookie_expiry_days',-58.01339,9.269631,9
Text_input returns nothing unless mouse is clicked,56.198498,21.816376,5
Add 3D co-ordinates using pyopengl within streamlit,-45.74059,-48.541367,9
Prevent Streamlit Session Resets,-45.063957,-11.01916,9
Cropping time data using interactive plotly plot,12.289273,-87.98588,3
Detect reload page or close browser button,17.778646,42.275787,0
Runtime error,-31.098345,37.860878,1
Problems with deducting dates in datetime format from one another,25.344233,-85.004005,5
Link to file not working,-4.615786,13.985233,6
  overlay and subplot do not plot (Chart empty),-1.6307361,-78.39481,3
DataEditor: Conditional Categories and Inputs,50.800716,-39.935223,5
Apache airflow,-39.18724,-29.90016,9
Suppress dataframe inference warnings,42.782967,-54.58569,8
D-tale in streamlit,-44.3763,-42.749084,9
TypeError: object.__init__() takes exactly one argument (the instance to initialize) to design robot gui,-60.581837,31.026161,1
St.file_uploader() too big [design and layout],-29.960136,70.04786,6
Displaying ID and corresponding name in a CRUD app,22.765888,64.609955,4
Df.style.hide_index() code suddenly not working in streamlit cloud community server,0.35866597,-45.68638,8
Streamlit session state,-51.976673,8.9988,9
Get Windows authen in Browser when using streamlit,-31.681793,-6.867093,9
Customized Pages Directory,13.10326,21.115788,4
Blocking the selection of the same value in the slider,79.92946,-28.705887,7
Slider Creation and Update in While Loop,78.32139,-31.608997,4
Streamlit run myapp.py is not writing the files in the project folder but running the code from python is,-75.812584,-22.987019,9
Is it possible to disable retries on the `experimental_connection` query method?,12.325918,64.99175,2
Experimental data editor: How to force it to show all rows,59.18101,-39.521862,8
There seems to be an error in using the prophet library in streamlit,-62.40705,-56.81134,9
Ability to use st.camera_input on mobile device?,-42.299393,47.492092,5
Remove / Hide Layout Widget,55.27473,48.135437,4
How can i change the label in streamlit?,-36.728935,-54.315346,9
St.selectbox aftect another without submitting a form,82.38202,4.809866,7
Creating Wordcloud from Jupyter Notebook,-20.910484,11.172692,1
How can I use callbacks to change the available options in a multi-select box with st.text_input?,77.56279,5.655057,7
Disable editing a single column in st.experimental_data_editor,58.71786,-41.656197,5
Disable column sorting and disable editing row index,49.217907,-43.16419,5
St.metric in dataframe,40.193756,-38.586433,8
File uploader component throwing JS error while mapping to public URL,-37.16027,75.40297,6
Solve it with a $20 reward: Can not load model: OSError: Unable to open file (file signature not found),-50.05165,55.66712,1
Avoid to rerun certain parts of code,18.73775,53.967957,2
Disable cached function warning,0.47745445,72.56086,2
Aggrid cell not rendering html through javascript injection,12.861712,-44.008812,4
"Vaex hdf5 file in streamlit : problem with the attribute ""between""",-52.500626,-22.480507,9
Is it possible to have a signal for when the user session expires?,27.289207,72.21892,2
Is this a good way of stopping an async loop when a session has ended?,27.641773,71.023315,2
'Secrets' object is not callable,-66.32967,56.997173,1
Connect Sidebar Filter to other variables,72.306885,9.898046,4
pandas._config.config.OptionError: error with streamlit 1.11.0 and pandas 1.3.4,2.2022333,-48.37724,9
Streamlit rerun problem when developing on WSL environment,-55.985756,-13.862661,9
"Streamlit doesnot launch app, and keeps showing please wait in chrome",-52.292686,-7.802682,9
Pop-up spinner which blocks the whole screen while results are generating,6.7254505,7.8545513,4
Help with session state - multi-page app,39.106964,61.112434,2
Inserting streamlit line chart into pdf,-24.081043,-64.06032,3
"Clearing all selected items (check box, radio buttons & selectbox)",82.826164,35.93551,7
Any way to expand the display width?,41.091923,-12.91158,4
Image not showing,13.241812,-19.490635,1
Updating state within a loop,37.52306,54.745403,2
Change color of sub text of st.button,33.873642,28.51114,0
Error 413 while operating,-30.158958,36.75675,1
Calculating max value from selection,93.93148,-17.704567,7
Is it possible to use a button to adjust values in an editable dataframe,46.244907,-51.34528,8
I am facing this error when ever i am trying to run my python app using streamlit. Please help. also i am not using anaconda,-71.794815,-13.129101,9
Linking multiselect boxes with session_state and using dictionaries to subset dataframe. Returning empty df!,98.40182,-3.1485255,8
"Paddleocr conflict, please kindly help",18.09188,-60.273174,1
Feature Enhancement: st.code supports collasible code segments,2.4866045,15.439617,4
Prevent default value of multiselect from being deleted?,92.4222,-11.232431,7
FB Prophet 1.1.1 sudden failure,-62.74584,-57.037395,1
Submit button not redirecting to next page,46.561596,38.041447,0
Live Updating Charts - Multiple Tabs - Multiple Columns,8.735432,-72.87283,3
Is it possible to have a particles-js background in Streamlit?,-24.520252,-44.99902,9
How return the value of the cell corresponding to the specified row and column in the dataframe,33.513943,-58.611786,8
Use st.selectbox if submit_button = True,82.521545,5.034424,7
Read Word Docs in Streamlit,-24.387135,1.8784229,9
Copy paste file to another folder,25.480951,-2.2868996,6
Path to file,-56.166042,59.750607,6
Does Streamlit have a whitelist feature?,-47.13846,-30.164423,9
Hover text or title text on Plotly table cells,-14.158653,-89.03574,3
Hide None in st.dataframe,42.617718,-56.529476,8
Persistent logins,-1.5180371,50.68835,2
Isn't streamlit able to apply df.style.background_gradient?,0.16170771,-48.24959,9
Create a variable number of tabs based on dataframe values,27.917828,-55.151566,8
Streamlit passing pydeck layers as constraints,-33.33618,-84.166275,9
Custom Fonts on Streamlit (native),-8.755555,-48.07909,9
How to reduce white space between two streamlit component,-15.286115,-43.402462,9
How to center columns,49.173683,-21.510954,4
UnboundLocalError: cannot access local variable 'select_space' where it is not associated with a value,-43.41058,29.33743,1
Sidebar issues,44.418827,-4.1291523,4
Restarting a Streamlit App with a Button,-46.487335,-10.176761,9
Multiselect with date input not aggregating results,91.647644,-16.480343,7
Is there a way to show underlying code documentation from pydoc or sphinx?,-24.683018,3.534856,4
Is it possible to remove the highlight in streamlit tabs?,-5.0153437,-25.157904,9
Local testing yields OSError: Could not find a suitable TLS CA certificate,-63.628742,21.842611,1
Streamlit session_state doesn't work across sessions,-52.587894,8.861017,9
Get picture link/download picture from st.camera_input(),-42.72356,48.06779,6
Is there a way to only rerun a part of the code whenever a widget changes?,57.385353,46.677147,2
Issues with connection to Google Sheets,-9.904594,-10.265862,1
Using `st.markdown` with HTML is changing the look of the whole page,23.657532,-10.770508,4
Displaying a tqdm bar with multiprocessing,8.321437,-75.415596,4
How to properly set st.session_state in streamlit,-52.92253,8.330258,9
Scrollbar for a high number of tabs,37.18948,0.5255915,4
Image partially displayed as black box in Streamlit app after deployment,-65.96206,-3.2742689,9
Please help me out with type-ahead - Works in localhost but not on cloud,-62.060917,-5.222673,1
"Hide ""Button B"" with ""Button A"", without clicking twice",31.05662,37.007553,0
App Reboot/Update at regular time intervals,11.05016,53.61454,2
App runs slow when multiple users accessing,-10.075867,57.201805,2
How to implement a spinner while waiting for the response,7.1463795,7.8227487,2
Streanlit custom components export,5.0365605,-14.718822,4
Avoid editable options in selectbox?,86.6968,5.7413206,7
Problem with geopandas,28.540659,-62.675488,8
Pyinstaller spec files,-61.99072,-25.323925,1
Generate pdf report from dataframe and charts using Jinja2 and pdfkit in streamlit,1.5639889,-52.15919,3
Debugging streamlit in spyder,-62.934895,-44.913185,9
Dynamic selection boxes within forms,80.361565,6.1723714,7
Is there a way to link to a tab?,21.791388,13.611518,4
Config.toml do not apply after deployed,-71.57604,55.25954,1
Auto-collapse an expander in a form,65.28233,-15.71492,4
"On hosted site, Streamlit not using config.toml",-73.93051,50.575462,9
App is taking too long to deploy,-32.022102,51.993286,1
Button / `st.session_state` bug introduced with 1.20?,37.354496,72.038315,2
Issue rendring youtube video using st.video() in Docker container,-39.181103,9.666166,9
Line_chart order of lines are not right,8.960546,-83.21031,3
"Session State, Update data from list in list",44.960136,75.1048,2
Streamlit local host shows up blank,-59.515594,-6.123896,9
Customize color of tags in streamlit,-20.539227,-44.137386,9
Utilização do Streamlit,-44.742527,-38.208942,9
Is there a way to display the uploaded file tab option when navigating back to a page,-28.761759,75.590065,6
St.experimental_data_editor reruns script after changing just one cell,59.344963,-42.932774,2
"Streamlit local run , ModuleNotFoundError: No module named 'torch'",-62.47491,28.34435,9
How to add more fields based on user input?,60.735367,16.516998,5
Select same item several times in multiselect within a form,88.577614,-13.125922,7
How do i fix this TomlDecodeError?,-69.150475,51.746838,1
Download an streamlit table to pdf,-22.214869,-2.4310958,9
Processing Error,-30.008398,33.60809,1
How to sign up for streamlit for team,-52.895435,-47.384716,9
Question about Streamlit for Teams Pricing,-53.11965,-48.78397,9
Can we create a custom section in config.toml?,-72.4201,56.248737,4
"Is there Streamlit App Limitations such as usage time, users etc.?",-43.22691,-34.190624,9
Initialisation of ML model from Huggingface leads to lost connection,-56.8183,52.11457,1
Deployment error due to version conflict of protobuf,-81.666985,20.687166,1
How do i wrap a custom component (React) into st.columns,56.240253,-17.122513,4
How to styled st.expander in streamlit and python based on value,69.55098,-18.6913,9
How to trigger custom event on a hamburger menu option click,8.432391,-4.1633143,4
"Struggling to ""add to favorite"" a restaurant from an API",-5.8711066,42.968765,2
Combining st.button with st.experimental_data_editor,61.875233,-41.807045,0
Delay in CSS Injection,4.6772714,33.03584,4
Keeping a log of all user interactions on Streamlit app,-48.04255,16.051567,9
Issues with color and palette,32.328026,-29.603058,1
PDF Generation through Streamlit Sharing Cloud (HTML to PDF),-22.415651,-0.9499638,9
Add an API to my Streamlit app,-43.27368,-29.111238,9
Custom Navigation bar,41.344753,-0.4819619,4
On_click function on multiselect box - multiple execution,87.74631,-11.180023,7
Printing a hard copy with some shapes,13.760253,2.938214,4
How to find .streamlit/config.toml file?,-73.87544,51.01483,9
Altair Chart x-axis not in order I want,5.285502,-87.95111,3
Updating starting dataframe in experimental_data_editor,60.220325,-44.34323,8
Autoscroll,35.028008,2.0992243,4
How to store user inputs into local variables,56.732166,11.929412,5
Multiple st.selectbox with value depending on each one,80.59088,2.2875788,7
App 'Delete' option disabled,-19.854675,61.79379,1
How to check the sidebar state,47.321556,1.4063213,4
Editing user-submitted PDF with PyMuPDF then making it available for download,-21.004425,2.5937014,6
Check if Sheet Exists After File Upload,-36.142647,78.97279,6
Need help with updating text in Streamlit app,-56.753967,-8.509227,9
How to chage the streamlit_chat message profile photo,-8.394883,-18.930298,9
Data Visualization adopting Deta (Database) to create Echarts,-2.8333068,-60.345642,3
Automatic data update,10.382184,44.588406,2
Make input fields required* using st.form,62.852608,21.173786,5
@st.cache_ not running properly,-2.9261382,83.6796,2
To create send button cooler!,33.474358,35.105946,0
Cache_data or cache_resource?,1.6772113,85.37658,2
How to add a line break inside longer cells in the display of an Excel file?,48.20086,-29.14211,4
Don't reconnect to the server,-9.069927,75.199745,2
Gspread together with streamlit is extremely slow,-60.394985,-33.843616,9
Accessing Refresh Token with Streamlit MSAL,-29.287678,-13.96467,9
Displaying newlines in streamlit table,-7.4863076,-40.334187,9
'XlsxWriter' object has no attribute 'save',-5.205552,-8.560747,1
How to display matplotlib graphs in streamlit application,-32.364223,-67.52652,3
Month Selection Calendar in Streamlit,-9.548576,-55.6175,9
No module named 'gpt_index',-63.959023,29.980274,1
VSCODE isn't recognizing config.toml,-72.13895,54.934822,1
Strategy for caching monthly released data,5.3393903,83.37103,2
Disable the button until the end of the script execution,22.861917,49.728935,0
Unable to connect to snowpark,-23.553732,43.398495,1
Unable to remember state after experimental_rerun(),13.244486,62.491497,2
Download file best practices,-10.368103,8.697518,6
DLL load failed when using Streamlit (with pyqgis),-82.47701,-19.443037,9
Control shift with enter key,50.608307,30.959211,5
How to left align column headers and values in a dataframe?,39.731586,-45.492115,8
I got an error when using scikit-learn with streamlit,-70.65871,-11.683277,9
Building a gstreamer app with streamlit,-41.73206,-35.030674,9
App crashes after uploading image files on/from mobile - but works fine on laptop,-24.577343,57.060726,6
How to use pretty_errors module in streamlit?,-69.642624,-13.79185,9
Best practice to save and load widget state from file? (Multi page app),53.394997,51.73724,2
Tab names are not rendering correctly when switching between pages,20.655703,10.045513,4
How to visualize the geometry by cutting into part,9.039966,-56.61669,4
Form elements using CSS,31.678215,-18.386398,4
How to dynamically change the color of plotted 3D image using streamlit and pyvista,-36.25706,-64.9141,9
How to remove white space between markdown,31.833431,-10.140871,4
Stop button displaying true/false underneath,26.486506,49.928646,0
Error installing requirements - protobuf,-81.601204,20.731941,1
Streamlit rerun problem!,-54.450573,-16.714577,9
This is about streamlit number input and its UI,-10.998486,-22.770638,9
Click Button without refreshing while the app is still running,26.357712,46.17446,0
Multiline multiselect,88.0568,-16.943735,7
Key Error for st.session_state variable when stopping the streamlit webrtc live camera analysis,-52.545025,6.391889,9
Horizontally align columns with text and images,21.922369,-29.063955,4
How to plot a simple 3D point cloud without any map and update it regularly?,-5.3168745,-65.965294,3
Newlines 'about' text in menu via set_page_config()?,9.131103,18.053965,4
Plotly showing incorrect figures in the axis,-11.962704,-85.27546,3
General question about how to distribute files in a project,-39.050842,67.88939,6
Problem,-28.151917,28.480103,1
"Tôi cần trợ giúp, chuyển đoạn code sau đây sang môi trường streamlit",-43.51813,-38.813873,4
Server closing by itself from terminal,-9.259629,74.62115,1
"Encountering a DeltaGenerator error, which displays carbon_total as a long delta generator string",-23.004883,18.016882,1
How do I play audio using an external JavaScript library? And why isn't it working?,-29.315825,13.359532,1
Trying to utilize string st.session_state values inside a run_query() statement,35.988106,72.855896,2
Custom UI file uploader,-38.03133,72.4874,6
How to filter a dataframe using selectbox?,53.857864,-55.748486,8
How to turn off resize trigger?,-6.518062,-77.28212,4
Merge cells with st.dataframe or st.table,28.886793,-66.29239,8
How do I clear number input after i have save data,63.03143,10.025443,5
Creating website to collect input from user and plot onto chart,8.524003,-64.767784,3
How to split pages in partials,17.806236,22.331636,4
Longitude and latitude in secrets.toml file,-68.285774,55.957054,4
Status of st.callbacks.callbacks,43.47504,48.451607,2
Error after deployement,-35.138184,50.73848,1
I created youtube video downloader that video storing on same file where the code is there,-26.682207,11.266011,6
Have only one horizontal scrollbar for two streamlit.writes in two streamlit.columns,-8.655268,-35.698303,9
How to access sStreamlit app on Databricks?,-88.75982,-16.343082,9
Unable to use sketch with Streamlit,-43.55228,-47.36215,9
Screenshot in Streamlit,-31.872551,-45.277107,9
Live tracking of a driver location,9.737041,-52.496407,4
Internationalization streamlit with pygettext,-79.139084,-18.980343,9
Sunburst chart gives empty output,-3.2871325,-78.595634,3
Session timeout,27.049116,74.95573,2
Import in inner files,-58.927593,40.956863,6
toml.decoder.TomlDecodeError: Empty value is invalid (line 3 column 1 char 25),-69.35409,51.666527,1
(always) rerun error,13.645306,55.408028,1
Clear cache not working (Thread 'MainThread': missing ScriptRunContext),7.0028443,73.006775,2
Go to specific page in PDF after loading it,-16.851204,-0.83175564,4
St_aggrid Hyperlink Render Issue but only on linux server,12.66336,-43.85031,4
Why there is no streamlit connection with Azure adls storage,-25.36983,-3.3081307,9
Attempt to create a Drop Down Menu to avoid too many filters,68.39204,-3.5154827,7
I want to store the xlsx/csv file in subdirectory & I want to download that specific file through app by providing download button to user,-9.247255,3.0040934,6
Displaying the video after applying yolo on a video,-44.369144,8.782304,4
Some css question on st aggrid,13.622203,-40.593777,4
Auto refresh an iframe inside streamlit?,-0.8993446,-20.034964,9
Connecting to RPI with Bluetooth,-21.08787,43.654285,4
Getting python 3.10 to recognize streamlit from an import statement,-79.3016,-17.377056,9
Get HTTP headers in streamlit,-37.643192,-5.60133,9
Mystapp.com/how_can_i_personalize_this,30.23944,-1.3222914,4
Plotly drill_down function via streamlit?,-26.537338,-71.695496,9
"Aggrid Table disappears, zooming in and out fixes",14.427539,-44.568516,4
Session State_Selectbox_Multiselect,97.45357,-2.2438507,7
Streamlit hangs while trying to run any app,-52.994915,-11.727595,9
Aggrid Selectbox issue in streamlit,11.7294,-43.09551,9
Export to pdf updates,-18.66849,-2.2217014,6
"Streamlit Table Sorting, ""None"" Value shows on top",-6.0026307,-38.419785,9
Streamlit Cloud + SQLite,-26.071589,-7.581215,9
TypeError: Can't convert object of type 'UploadedFile' to 'str' for 'filename',-49.03795,62.336216,6
File Uploader not giving a pop up to upload file,-36.701008,74.47731,6
Set_page_config problem,9.1897135,18.983711,1
Missing value from two fields in a form,59.91175,20.052559,5
Unable to open file(file signature not found),-51.05044,57.036278,1
Error https.client.Cannot.SendRequest: Deta database or Google Sheet API,-9.486461,-11.05943,1
How to avoid running a function that reads Google Sheets every time a filter component is selected/clicked?,74.10405,8.02154,7
How to do a sequence of forms,69.39438,25.125557,5
How to paste multiple values into a multiselect,89.213,-13.62909,7
What is the current page in use? Multipage App,14.598153,27.234406,4
Is there a method for navigating to a particular location in a page from another one?,24.14733,29.050564,4
Dismiss st.info,22.820955,-4.8816943,5
Page_icon & Title not showing on subpages,25.053131,17.659374,4
Visualization of stl files,1.0931358,-60.224724,3
Radio button not waiting for user input,84.22809,23.545214,5
Match: SyntaxError: invalid syntax,-38.12141,31.962936,1
Hpw to cretae this tiles view,15.685906,-51.5116,4
Too much blank on the left,-9.998134,29.381075,1
Apps keep returning after deletion,-19.567987,61.25857,2
Unable to change default option in streamlit app when using multiselect(),0.4821673,-30.04807,7
Could I make streamlit support Plotly resampler?,-27.006441,-72.55742,9
Choose value from st.select into st.experimental_data_editor table,62.77015,-41.73336,7
How to add scroll bar in st.expander,66.23379,-18.53659,4
AttributeError: Gensim 4.0.0,-57.614418,26.645643,1
.streamlit/config.toml is not run when docker image is created,-74.50187,51.050743,9
How to fix DuplicateWidgetID: There are multiple identical st.button widgets when there are no duplicate keys in Streamlit,65.86799,53.939926,9
Error mol2vec,-32.49938,35.398933,1
Adding Holoviews/Datashader to Streamlit,-46.03607,-36.736607,9
How i can solve this error,-28.628923,34.86596,1
Experimental_data_editor category interdependency,61.617226,-40.398483,4
Need help with OneLogin auth integration,0.31140965,53.96189,1
Serving static files,-29.107977,3.9526155,6
"Page Collapse, initial_sidebar_state",48.42636,1.1467459,4
TA-Lib cant use in streamlit,-69.30419,-15.821548,9
Submit Form containing file_uploader (with multiple files = True) needs to be called 2 times for it to work,-32.979782,76.83112,6
St.session_state initialization error,34.009853,74.943886,2
Unable to change default value of multiselect() on selection with polars,93.860985,-11.904345,7
Write and text_input updating with delay when clicking on widget,56.493523,32.53967,5
The dynamically created text_input boxes disappears when the values are changed,51.213284,20.533453,5
Embed charts inside displayed dataframes?,27.637093,-59.929665,3
Proper use of on_change with st.experimental_data_editor,61.117596,-42.999702,5
"Disabling ""upload widget"" after clicking on form submit",54.36641,46.667374,6
Tooltip on st.write and st.markdown,25.650293,-20.041342,5
Images,16.642849,-29.96411,4
Can the label in st.expander() be multi-line?,69.82895,-16.8206,4
Text input/button/check box clear session state,44.539345,67.65367,0
Sidebar button doesn't work,43.622204,-3.7677336,0
Images vibrating in app GUI,73.936195,-30.533218,4
"Error ""FileNotFoundError"" while the file exists",-53.722523,62.091354,6
"""reset"" experimental_data_editor to original values",60.39619,-42.590305,5
Streamlit Components: Embedding an iframe that is dynamic to the sidebar,0.28550848,-20.154613,9
Select pointer roles back to zero index of the select box options list after selecting an item,87.454895,6.8002863,7
Explaining run logic with buttons,31.244648,45.59606,0
How to change the backgorund color of button widget,32.94432,28.315495,0
Leading Gap,31.736675,-12.438299,4
Detect whether code is being run from mobile,-12.314455,17.10343,2
Open URL using button and add plots to new URL,20.23412,32.455486,0
Sidebar button doesn't work after first click,43.477585,-3.656317,0
"Is there a function called by text_input change, everytime when I input a character?",51.965996,22.596222,5
Help with Streamlit/Shiny comparison,-45.19599,-43.844425,9
Initialize new user session,32.62882,75.09606,2
How to zoom st.image,15.472007,-25.577648,4
Scrolling in a column,34.89185,0.27451384,4
Change choice in st.selectbox by clicking on a button in a side bar,84.21199,4.829097,7
