title,x,y,cluster
Streamlit select box not retaining selected values and its inconsisting,-0.31884602,-34.30778,7
How to import ib_insync?,-58.095264,40.295113,1
[Bug] Weird behavior in Multipage apps with Query-params,15.142438,67.57777,2
Lottie in sidebar,44.429398,-1.3101833,4
How do I create a list of values with st.slider in a loop?,78.63231,-31.983604,4
Streamlit duplicates log messages when stream handler is added,-49.731133,15.800845,9
Creating a task queue using streamlit,-48.316887,-22.890963,9
How to keep a button activate?,33.102432,36.391445,0
Streamlit Architecture (Technical)/ Software design pattern,-47.78757,-43.891396,9
AttributeError: module 'matplotlib' has no attribute 'use',-11.08806,-65.89159,3
Setting a Streamlit Theme,-22.329748,-41.242252,9
Use experimental_singleton with Enum's,8.813358,65.845276,2
Module not found error,-64.807014,30.62511,1
File_uploader triggering second time when we click on other buttons in the same page,-32.37384,78.29553,6
Side by Side clicks to switch between pages,19.025927,35.4397,0
Error deploying my app on Heroku,-31.72121,48.58184,1
How to check git version when streamlit starts & include on each page,-58.5784,-0.82616466,9
Changing height&width of st.sidebar.multiselect,85.03694,-15.625945,4
Getting Streamlit running,-55.30193,-15.729738,9
Error,-27.601965,33.989407,1
Data collision with multiple app pages,14.415559,25.286213,2
New changes to menu complicates development using gitpod,67.56931,-1.558251,4
How to change column index in pivot_table,27.876448,-69.927635,8
Detecting if using mobile browser,-12.299193,17.097319,4
Upload audio -> convert,-35.408745,15.712902,6
Widgets height,47.05234,-17.378904,4
"""Clear cache"" button on hamburger menu disappeared",9.501663,75.59348,2
Datetime slider resets to original value on change,75.95157,-38.54272,2
Tensorflow model giving same output in streamlit,-74.74195,-6.5168276,9
Streamlit Strength Combined With Djangos,-89.84051,-24.332937,9
Adding text to pydeck scatterplotLayer,-29.087353,-86.94356,3
How about the security level of streamlit framework?,-46.73851,-32.263885,9
Error A15,-28.128801,33.569775,1
AttributeError: 'google.protobuf.pyext._message.RepeatedScalarConta' object has no attribute 'uploaded_file_info',-50.279865,62.4294,6
Integrate JS components,6.5460286,-12.276022,4
Security options for Streamlit,-46.70044,-31.85546,9
How to export PDF file,-18.519949,-2.2928133,6
Problems using st.write() to print a string,18.87748,0.31824785,5
Help with accessing SQLite database in Github Repo,-15.459231,43.390408,1
How can I remove some of the items from Hamburger menu?,8.017434,-2.9777944,4
I am unable to deploy streamlit locally on my MacOS 10.11.6 system. Get seg fault,-68.21234,-1.9863306,9
How to embed the Tableau with iframe properly?,2.533978,-20.15051,4
Text_area widget data not always refreshed,57.973965,34.968407,2
[Solved] Error when accessing cached database via dependency injection,-7.239236,79.70974,1
Change file_uploader text,-40.617146,73.90738,6
"Streamlit css parameters (padding, colors)",-21.11696,-33.732586,9
Filter without rerun the entire script,18.604929,52.22687,2
How to suppress warning during direct python running?,-18.19103,34.419884,1
Production deployment a la Flask/Gunicorn,-87.42441,-22.361029,1
Data table from selected Month Selector out of 365 daily dataset,22.02693,-85.893295,8
How to make a siderbar menu like the official website?,42.58829,-0.6331621,4
How to get your dynamics button appearing side too side,49.449047,5.1168046,0
How to persist a dataframe with st.session_state?,42.25301,78.85638,2
DatabaseError SQLite3 in my app,-16.547009,42.95866,1
App is not showing anything,-19.699488,58.325394,1
How to add a new row by clicking a button?,57.482822,-7.605334,0
How to change column name in the predict table?,38.9535,-55.97377,8
A3 error- unable to update user,-0.45443696,41.90248,1
Git pull failed while deploying,-33.59551,49.29538,1
My translation app is not working,-20.814941,59.215446,1
How do I layer multiple matplolib figures in Streamlit?,-33.501556,-68.588715,9
How to normalize a json file when using streamlit file_uploader?,-54.542686,0.39961308,9
A User Counter for Streamlit Tool on Streamlit Share,-43.81511,-25.348715,9
Problems when iterating over items using form,69.338936,26.303698,5
Can't import streamlit,-80.413055,-14.701374,9
How can we integrate Cesium JS (3D map) in Streamlit,-45.421967,-53.27173,9
PermissionError,-42.594822,35.397602,1
Stuck in the Oven,-15.267996,63.9218,1
"Multiselect and slider, can't get current value by on_change",84.88529,-18.71646,7
File_Uploader in form needs two form submissions to save image to session state,-24.359627,80.41476,6
Nice way to display 'snapshot' of uploaded long document,-40.893166,67.818146,6
How can i get an array(json formatted) from html which is embeded in streamlit,-27.062418,-31.664225,9
Split st.radio in columns,81.70978,25.715881,4
Which MIME type to download Excel files?,-10.164125,1.1651196,6
How do I convert my select box too multiselect with dynamic code,87.04124,-7.0441666,7
AttributeError: module 'streamlit' has no attribute 'metric',-73.05495,-18.348259,9
How can I creat streamlit dashboard with python that sequentialy loads images?,-35.778065,-45.804317,9
Using device's IP address to pinpoint its geolocation,10.579497,-53.066372,4
St.metric() error - AttributeError: module 'streamlit' has no attribute 'metric',-72.81761,-18.357073,9
Pop up window graph,-16.110653,-17.192617,3
Hiding errors while waiting input data,-14.691947,31.328228,5
Form Button logic state cannot be captured,43.91228,39.00168,0
How to make two DL Model in multi page,9.382196,28.121607,4
Still have when sign in Error,-2.8163342,52.98718,1
"Fixed height, scrollable container for checkboxes",33.659065,-1.7701156,4
How to make data frame editable and update back into the database,46.139347,-50.51382,8
Is there a way to obtain the path of file when using file_uploader?,-45.800632,74.15328,6
Webapp goes blank,-8.709823,30.539312,1
How to plot race bar chart in streamlit,-25.356253,-62.043587,3
Download function for streamlit app,-28.822767,-0.6895432,9
How to nest selectbox,81.285,3.3605473,7
toml.decoder.TomlDecodeError: Key group not on a line by itself. (line 2 column 1 char 1),-69.424355,51.0082,1
Can a range slider move parallel / synchronously?,76.62058,-36.20411,4
How can I make a df cell hyperlinkable?,32.329014,-46.49518,8
Ignore an alert: 'Bad message format',-20.5164,34.159306,1
Share the selectbox output across scripts,91.94124,4.3478827,7
What is roadmap for Flask to Streamlit migration?,-87.44217,-22.849262,9
Preserve value of widget after error rerun with session state,55.01004,54.713696,2
Maps with Altair and GeoPandas,4.4381056,-92.68673,3
Stripe,-18.3726,15.872155,4
Styling st.text using separate CSS,31.411459,-17.833248,4
How can I switch between two buttons and change their session state?,39.567417,65.49917,0
Error running app -> resources limits,-18.878384,54.489582,1
有没有出现 数据库链接异常？,-5.222946,-13.017447,4
Display Image as link using markdown,16.218834,-19.020369,4
Some emoji missing in Streamlit,-25.688137,-24.895294,9
"Drawing boxes on images, capturing clicks, and capturing key strokes for labelling/cleaning an image dataset",21.913279,-22.16034,4
Please wait... connecting: I get this message when sharing over the network,-3.1319726,37.683514,1
Clear Cache for file upload,-30.033747,84.102684,6
About path of config.toml file,-71.951355,55.576473,1
Exceptions display,-14.291075,33.158344,1
Merging multiple dbf files by file uploader,-31.615324,75.43163,6
Datetime slider,76.6711,-39.566998,4
St.map可以使用百度地图吗？,15.791487,-59.50132,4
Trying to alter a empty widget in a function has no effect,59.348175,47.22746,5
Multi Select is Not Filtering DataFrame,55.539032,-57.8736,8
Auto expanding chart,10.902937,-77.01491,3
Ghost Elements in UI,29.445263,9.247547,4
Multi page app in streamlit based on condition,-22.033329,-17.099783,9
Conditioning for st.form,66.048775,22.785301,5
Plotly legendgrouptitle parameter not working with streamlit,-23.684465,-70.82181,9
Error using upload button with release 0.88.0,-36.501865,72.600296,6
How's the Inline CSS is working with buttons?,31.370413,30.183739,0
Where does to_csv file saved?,-4.223956,-0.055736545,6
Image Classification in Streamlit,-34.918423,-48.781544,9
Streamlit Sidebar Questions,-13.568439,-36.078114,9
Streamlit selectbox setting value,-0.046466243,-34.173725,7
Session State Checkbox Bug,44.10071,66.1053,2
Understanding Streamlit execution process,-50.315605,-29.774052,9
What shall I do for to build nice frontend with Streamlit?,-49.374413,-40.654163,9
Is there any way to have user inputs be in-line with text?,53.332516,14.589949,5
Partially Initialised Module,-61.262512,39.739864,2
Nested Dropdown,68.86089,-5.000282,7
How to get and use a value of image button,20.435251,-24.571009,0
How to align st.plotly_chart and html component?,-8.515307,-82.60314,3
Is there a reason why streamlit won't load new pages?,-40.157642,-15.705968,9
Unicode Error when Rendering Table in Streamlit App,-8.775805,-40.389854,9
"TypeError expected str, bytes or os.PathLike object, not UploadedFile",-49.06235,61.33736,6
Streamlit is stopping,-50.751133,-16.750282,9
Trying to use brushing technique for my data app to make it more interactive,11.77584,-65.922745,2
Using Streamlit for Analytics,-40.030495,-42.008373,9
Local Image Button,20.58742,-24.721584,0
"ArrowTypeError: (""Expected bytes, got a 'dict' object"", 'Conversion failed for column place with type object')",-47.482018,25.548973,1
Controlling memory release on app with large pages and many sessions,-6.7953587,64.79796,2
Continuously updating dashboard,8.504006,47.388004,2
"How to call a column name dynamically in a sql query, based on the select bar option!",70.97294,-7.367654,7
Integrating a web API,-5.9798703,44.73074,4
Possible bug in app start message,-18.179857,53.67414,1
How to draw real time curve with streamlit?,-39.99475,-48.31758,9
File_uploader vanishing,-37.859104,77.210075,6
All loops running at once even before the inputs are being entered,10.455382,12.580179,5
How to make three select boxes and only select one of the options in the whole three select boxes is allowed?,80.02272,1.8186529,7
Streamlit screen shifting after experimental rerun,-32.60538,-15.442981,9
Trying to use st.multiselect() not getting desired results,92.337456,-15.198627,7
St.metric error,39.632153,-38.160236,1
Getting AttributeError: module 'streamlit' has no attribute 'set_page_config',-19.646652,-13.605733,9
Reading uploaded video from st.file_uploader as numpy array or torch tensor,-38.310352,16.120857,6
"__main__.gera_grafico(w1, mostrar_curvas) No docs available",-82.5316,-15.840375,1
How secure Streamlit session states are?,-51.259014,8.731383,9
How to save pandas dataframe to csv after click button?,34.895866,-48.088493,8
Streamlit-Folium Relative Width,-17.077742,-50.621483,9
[SOLVED] Plot data into different selectbox,90.5739,-2.844739,7
Saving a dataframe,42.70848,-52.444008,8
Object of type 'bytes' is not JSON serializable,-37.017826,27.23014,1
Paginated Dataframe,26.517319,-50.260124,8
Memory behavior,-4.51459,65.211586,2
ZeroDivisionError: float division by zero for Mathematical Calculation,46.131035,-36.55061,1
Using rpy2 within Streamlit,-78.51098,-29.080954,9
Application that works in local but not online,-27.951302,58.577698,1
Store user inputs,56.7235,11.851409,5
How to format float values to 2 decimal place in a dataframe except one column of the dataframe,42.265427,-61.706352,8
Slider does not work with dates older than 1st february 1970,76.50329,-39.687336,1
Is there a way to see RAM usage?,-5.695328,66.54915,2
Getting zoom info for Plotly plot,-16.352911,-79.37289,3
Weird session-state behaviour when storing a list of dictionaries,32.014038,69.49095,2
Dispalying a tweet,-31.464,-37.013165,4
Function re-running each time I want to sort output,17.320814,59.955902,2
Handle JSON output,-35.5313,24.401123,5
Is streamlit completely free?,-44.70997,-35.931965,9
St.columns on mobile (to-do list app) + session state demo bug,57.37724,-27.665508,2
Streamlit command don't work after successful import,-79.34502,-14.451015,9
Sympy Plot to Streamlit,-51.626446,-60.671066,9
How to show google map in streamlit app?,-40.79387,-56.34873,9
File and directory unfound,-55.08258,59.990204,6
What should be the requirements.txt for easyocr,-65.11053,33.641365,1
Streamlit Add to Homescreen,-41.44055,-36.553173,9
Sidebar not updating on re-run,47.21983,-3.3045716,2
Widget that is dependent on other widget doesn't update on rerun,57.586388,47.305016,2
Feature request: (image) button,20.473988,-24.57187,0
"Inorder to deploy my app through windows IIS, how to get the streamlit.exe file?",-63.2954,0.9771924,9
How to refresh my connection with sqlserver,-8.948573,75.96326,2
How do i add see more button in streamlit without restarting the whole script?,-19.119461,-25.646765,9
"Streamlit 0.84+ widgets are copying selected option values, breaking things",-0.7738269,-32.6645,9
Passing variable containing text to markdown,19.468128,-11.268614,5
How to get a selectbox within a selectbox (or multiselect within a mutliselect)?,86.9524,-6.4029994,7
Any Map Features?,14.134431,-59.468716,4
Deploying app in ibm cloud,-29.44705,54.62684,1
Need help in reseting contain of some text_input field,54.428925,25.387703,5
Normalize audio using pydub and load it on streamlit audio player,-31.19221,8.994389,9
Watching custom folders,-37.23357,-2.2250602,4
Image carousel,18.791101,-34.140903,4
Returning to the Homepage automatically,16.625181,39.949856,2
Segmentation fault (core dumped) when load my pytorch model to cpu device,-55.37446,48.440994,1
How to create recurring forms with unique keys?,70.64446,25.485102,5
Sending OSC messages - change IP address,-68.63251,9.830818,4
How to add extra lines space?,32.79152,-11.70255,4
Import googlemaps ModuleNotFoundError: No module named 'googlemaps',-60.587807,29.149822,1
ModuleNotFoundError: No module named 'gekko',-61.976437,31.344912,1
Session State Multi-page App MWE,39.025795,61.156223,2
Can't deploy FbProphet based program in streamlit,-71.807755,-0.6709913,9
Any way to prevent commented-out code (via triple quotes) to be displayed in Streamlit?,-52.72184,-25.867298,9
How to refresh cache when a file loaded from a url is updated?,6.730315,78.2704,2
Change backgroud color - streatmlit.component.v1.html,4.2087665,-27.566135,4
Altair Chart not supported in streamlit for inline slider,-29.26462,-60.84699,9
Best approach to mapping with dynamic updates,14.611645,-55.08518,2
Updating Line Graph Faster with st.slider,-4.8203087,-71.372475,3
Navigation panel - can we have a button on the right hand side like 'Next' which automatically moves to the next 'page' in the navigation panel,21.14285,26.308989,4
Click st.form_submit_button without changing dataframe in another st.form,49.034203,-56.313694,0
`missing ReportContext` warning when using apscheduler's `BackgroundScheduler`,-59.842678,24.467485,1
Issue with st.empty(),22.761808,3.8265023,5
How to insert a new st.form or st.button inside other st.form?,45.751865,33.169075,0
How to capture Screenshot from streamlit web App,-31.867493,-45.196728,9
Sharing streamlit link app shows a thumbnail,-41.703346,-7.3080783,9
Session State: initialization errors,33.94296,74.64095,2
Reset checkboxes after submit is clicked,80.753006,38.040348,0
Problem with datatype of columns in a dataframe dislplayed with st.table(),37.362442,-59.021217,8
Negative number formatted as integer gives ArrowInvalid,58.919575,6.3075056,5
Loading LAS Files - list index out of range,-40.495686,23.748617,6
DLIS file uploader,-38.339417,71.72703,6
TypeError: _translate() missing 2 required positional arguments: 'sparse_index' and 'sparse_cols',-51.592934,35.620453,1
Multiple Identical Text_input in streamlit,-9.639411,-24.39454,9
Does streamlit web app not support webinspect to scan the code?,-35.172916,-29.741415,9
Session state key-widget association bug,55.417107,57.383095,2
Streamlit - TypeError: sort_index() got an unexpected keyword argument 'ignore_index',-41.382725,23.954271,9
The value is always static,41.68191,22.560013,2
Streamlit with pyautogui,-75.14826,-36.574474,9
Image not displaying,13.242666,-19.535975,1
Number_input variable result in: IndexError: list index out of range,62.36273,8.368656,5
Streamlit with session_state,-52.476692,8.723128,9
Send data from Streamlit to other app - POST request,-40.394623,-27.222815,9
Select of examples overwriting text_input,55.136883,23.295095,5
I cant able to run application built using python using streamlit,-76.83455,-23.969398,9
New layout columns,51.056583,-23.659414,4
Help! White screen after clicking the button,36.56224,34.09393,0
How to put a 3D scatter graph into the app,-4.6641736,-66.93384,3
I am getting this error i need help :/,-28.61105,35.823715,1
Updating/saving csv to local machine with user input,-2.9889247,0.017670067,5
Take an input list of float,63.510105,2.489046,5
How to check if column (st.beta_column) is empty,62.626263,-26.750788,5
Dtreeviz on Streamlit,-47.4272,-59.035694,9
File list in upload directory,-37.183334,68.54528,6
Streamlit resetting the Slider for v0.84.1,-26.163673,-13.031703,9
Dropdowns which depend on choice of the first dropdown don't update while using st.form,81.61279,9.034186,7
Handling Exception Error,-14.276002,33.192066,1
How to customise the visualisation of a dataframe,29.379515,-59.630928,8
Why is my reset function constantly rerunning?,15.928129,58.555576,2
CustomJS callback for select widgets to update bokeh scatter plot with streamlit_bokeh_events,-53.02072,-71.337555,3
Another topic related to page refresh!,16.048342,40.947254,2
Can't change page in multipage streamlit app,-21.936779,-15.2795725,9
Www.streamlit.io homepage can not opened as fast as discuss and docs page,-39.15811,-12.877258,9
Errno2 No such file or directory,-52.254593,60.48178,1
Add annotation to chart directly in Streamlit,-24.246569,-58.290443,3
"St.button on_click, unexpected key word",35.84666,44.7065,0
Session State of multiple inputs text,45.806202,69.16096,5
Can i create a rating system by adding stars into each records using streamlit?,-35.73466,-24.61011,9
Writing output from button to csv with pandas,34.965935,-48.046307,8
How to create columns dynamically,56.227253,-23.210676,8
Using QGIS with Streamlit,-48.242455,-36.89137,9
Display and value mismatch with warning,-26.1119,31.624062,5
St.text_input(),53.795853,21.92914,5
Difference in behavior with asyncio in st vs jupyter,-14.880403,74.19829,2
How to change df.pivot_table result into dataframe?,27.988073,-69.97691,8
Plotting holoviews plot,-16.91886,-72.48115,3
Dtype conversion error in V0.85 of the recent Pyarrow migration,-48.125618,24.515364,1
Error while trying to deploy streamlit,-67.612404,-2.4439063,9
Holoviews not working,-17.047403,-72.66102,1
Select Box without label,78.47997,-1.5305895,7
RuntimeError: There is no current event loop in thread 'ScriptRunner.scriptThread',-33.56731,41.461285,1
Convert Uploaded file so it can be predicted by classifier,-44.985645,69.860374,6
Model does not responds to the changes in input,44.75973,21.290129,5
Import Plotly error,-16.201195,-85.314735,3
"Interactive Widget Session State:How can it return data index by session state,PLEASE?",53.538357,56.002563,2
Could not read from remote repository,-27.054132,47.401985,1
St.spinner only on top?,8.105745,7.1302342,4
Filter dataframe based on multiple criteria,52.73275,-58.26521,8
How to add emoji to a button,28.078728,20.589165,0
Could we let st.form area be folded after st.form_submit_button be clicked?,50.19693,37.593605,0
Incompatibility with Geopandas,28.507431,-62.718494,8
Removing an item from multi select,89.101105,-12.705923,7
Hang/infinite loop when calling from Python,8.94302,13.6335,1
Slider With Number Input,81.71025,-32.504948,5
Sync method in st.session_state,37.012024,74.14854,2
Deploy streamlit app using nginx,-65.278015,-1.4783826,9
Error in Web App,-18.451681,52.397076,1
Dependency Between Selectbox and a Changing List,82.40537,7.040546,7
Machine LEarning,-4.9889507,-17.088804,4
"How to Add the ""Copy to Clipboard"" button near a text",26.246002,-1.011633,0
UI content retains on using multiple sliders/buttons,75.36708,-32.2,0
HTML Components remove on button click,39.91362,26.151516,0
Session state with 2 buttons,39.53884,65.80493,0
Dependent dropdown lists to filter pandas dataframe and output result,51.1197,-55.30374,8
Show select boxes/options sequentially,82.1315,0.9189706,7
Session state attribute error,37.70675,69.61711,2
Is there a way to have an Other option in SelectBox where the select box can take a text input instead?,77.80699,4.5785475,7
Combining session state with callback and checkbox inside forms,44.072292,65.48692,2
How to upload file to the specified directory of server machine?,-39.581596,70.09057,6
How to change the style of st.beta_expander?,65.55362,-22.127857,4
Facing issue in the deployment part,-34.469864,51.61555,1
Streamlit with opencv and yolo,-44.673214,10.021923,9
How to avoid screen Reset,27.895332,42.807163,2
Automatically Scroll to Top of Page on Data Refresh,34.32055,2.9284532,4
PowerBI dashboards and streamlit,-38.047092,-44.253735,9
Error unpickling model,-49.141094,41.012024,1
Streamlit with OpenAI Gym,-43.27844,-31.764814,9
How to make a button with a custom icon?,28.69067,19.757128,0
Updating Streamlit version,-57.34667,-8.088085,9
Multi-page app,14.230418,26.166178,4
Trouble installing streamlit on new system,-82.52412,-6.537956,9
Multiselect button crashes app,89.92837,-10.919687,7
How can I get a button that resets its state each run?,31.994188,42.026394,0
Possible to show Tooltips on hover?,25.84155,-21.192131,4
BUG - time_input,25.223665,-78.34397,5
Drawing vertical lines in st.line_chart,10.79838,-82.42126,3
Streamlit invite,-51.63864,-45.63402,9
Streamlit access bucket,-44.808865,-30.244375,9
Error after installing new version (84),-75.592186,26.9492,1
Issue with file_uploader and streamlit version 0.84.0,-56.120564,16.2103,9
How to keep the output of a button on MultiPage Setting?,39.366467,39.032207,0
How to import a local python file in streamlit?,-79.726265,-17.659536,9
Venn2 diagram,-0.027801272,-75.82847,4
Streamlit cannot install CPU versions of torch,-83.87463,-5.065681,9
Special instructions for a package,-76.126434,19.665985,4
Streamlit Dashboard - performance,-37.944714,-43.487057,9
Slider control overflow between beta.columns,78.639725,-37.311073,4
Import markdown file,21.258883,-11.730568,6
Running two functions simultaneously,18.468588,60.115726,2
Next button / open new page / session state,38.80657,65.181274,0
How st.area_chart() function anmiate,8.580312,-79.16422,3
The AI Algorithm implemented in streamlit runs on server-side or client-side,-51.034653,-31.242327,9
Unable to identify why App crashes after succesful deployment and usage,-25.611826,55.787563,1
Blindly following setup instructions,-34.893997,53.339367,1
Plotly autoscale/update issue,-10.109811,-79.75817,3
Reset select box upon a change in multiselect,90.99116,-9.825994,7
"I’d really appreciate help with this error running hello.py. I can’t find a solution to this error. I have tried upgrading, re-installing, and starting a clean environment: I even upgraded jinja2",-54.688656,30.64227,1
Callbacks - how to get current control value?,43.039394,49.628727,2
Summing values in line chart,12.004896,-81.13019,3
Line chart with Month in X axis,13.525695,-86.399925,3
"Cannot deploy app, and the app crashes every time",-25.692493,55.68043,1
Streamlit sidebar,-13.644126,-36.00639,9
How to change the graph dom style in streamlit?,-28.435541,-66.44725,9
Unable to filter data using multiselect,91.013336,-17.135786,7
How to refresh an app's page which uses caching?,7.1217175,78.31732,2
Image uploading from streamlit and store in sqlite,-26.299484,-7.205403,6
Session_state: del a value,34.75679,70.04488,2
Session state and external URL,34.501125,60.390083,2
Very serious bug in streamlit,-54.208935,-20.422926,9
Reconnect after macOS sleep doesn't work in Chrome,-5.291904,74.985954,2
Import streamlit does not work,-79.90985,-14.508124,9
Is there a way to display country flag emojis in streamlit widgets?,-25.648909,-24.91435,9
How to show filtered dataframe after user select value from selectbox in python and streamlit?,5.0581765,-42.784565,8
Programmatically Changing Text of Checkbox,75.21594,37.761272,5
Multiselect claims `options` argument is NoneType,93.75301,-12.836737,7
"Curious about the on_click/on_change, args and kwargs in Widgets",64.665215,46.93361,0
Updating an Streamlit table element by 'key' or 'id' to update data,-32.316982,-22.847383,9
"How to fix error""IndexError: list index out of range"" in python and streamlit",-41.1879,24.104649,9
Streamlit Raspberrypi architecture,-47.368385,-43.412807,9
Does Streamlit have a Build-In Support of Mysql Datasource?,-35.985363,-23.228046,9
Creating a Quiz with Streamlit,-11.900002,21.483086,9
Borders and / or container colors,36.1485,-20.901628,4
Upload multiple files to a temporary folder on a hosted application,-36.064266,68.29139,6
Https://rash-nlp.herokuapp.com/,-40.791866,-4.2580595,4
Uploading sensitive data,-23.458506,70.62433,6
Strange error: unable to understand what it means - streamlit,-63.020336,-15.559091,9
Line break when displaying a dataframe,31.82256,-61.61482,8
Disconnecting session when reading a large html message,26.922573,75.343544,2
Image Caption beyond Image Width,32.933704,-34.37786,4
Google Sheet Connection when I have more than one page,-10.085964,-9.823617,2
Subprocess.call() ~10x slower with streamlit,-66.01884,-35.033195,9
TypeError: __cinit__() takes at least 2 positional arguments (0 given),-40.120045,29.984835,1
Automatically refresh page,16.247274,40.536007,2
