title,x,y,cluster
Running out of Memory?,-5.4423547,63.842434,2
Plotly chart overlapping st.columns(),-8.519123,-82.63657,3
Anchor link does not work with japanese header title,12.7078905,7.8013215,4
Steamlit - Upload and use User Shapefile and Tif File,-33.000954,0.5686352,6
ModuleNotFoundError:No module named 'st_aggrid',13.462632,-42.05746,1
Not re-executing certain parts of code?,18.893236,54.007317,2
Launching from a Python script fails since 1.12.0,-51.43346,32.30445,1
On_change selectbox with only one option,84.33459,8.928384,7
"""text_and_dropdown"" on Streamlit",-3.4356394,-32.675137,9
Altair graph- streamlit,-28.950653,-62.08366,9
Map Plotting using streamlit.map(),-38.75892,-55.512295,9
ValueError,-43.187622,32.82095,1
Can not select usb camera - Component Error,-43.010185,46.444378,1
ValueError: Unknown layer: Custom>TFViTMainLayer when using a Google transformer model in Streamlit,-72.21835,-7.8565416,9
Executing code before rerun,18.271566,53.410084,2
Shows blank page but server is running,-9.759211,29.906754,1
Streamlit app stuck on please wait,-51.865704,-7.068444,9
"Windows Error: Streamlit requires raw Python (.py) files, not .pyw",-77.38143,-22.674702,9
How can I make this function execute in the background?,16.249086,48.942978,2
Showing the same button multiple times (e.g Submit button in a form),38.91912,41.02254,0
Does streamlit re-load python file from beginning upon clicking checkbox?,-28.369493,-19.244406,9
How to change items in the form with changing items in a selectbox?,82.93407,7.5012083,7
Session.state stopped working,36.98827,69.21732,2
Change the slider selected region shown by the color,78.14993,-28.629086,4
ImportError: libGL.so.1: Trying to run an app that uses opencv and pickle file for image classification,-52.442463,38.195084,1
Streamlit selectbox unexpected results when filtering,0.02104123,-34.281296,7
File Uploader for each page,-29.5818,75.10072,6
Real time 3D scatter plot with matplotlib,-7.9471684,-66.71158,3
Pd.json_normalize / to_list doesn't work as expected,-36.711555,26.089685,8
Add timezone arg to st.date_input?,28.103603,-85.85842,5
Is it possible to place escaped characters in a Streamlit text_area component?,-8.911741,-43.302612,9
St.code() adds a tab to code automatically start from the second line in a tab container,22.72705,8.694137,5
File uploader,-38.34117,72.08317,6
St.error appear to be faded,-18.68542,30.511133,1
Form submit works only on odd tries,46.268166,38.695145,5
ModuleNotFound Error in easyocr,-64.54094,33.559723,1
How to reboot streamlit app,-46.96693,-9.799189,9
Strange Line Chart for Temperature,12.731458,-82.65085,3
Running streamlit on AWS EC2 handling port issues | port 80 / port 8501 / nginx,-69.57372,4.233602,9
Streamlit handling Frozensets,-51.15261,-14.071766,9
Nested Button problem,39.66737,36.11927,0
Writing to a csv,-3.3184507,-0.6376593,5
Text_input,53.833836,20.519005,5
How to pass parameters through url between multiple pages,24.884323,36.389103,4
Modify st.text_input?,53.842545,22.76944,5
How to open a docx file directly in a new page,-5.681966,11.408478,6
Event handler called multiple times.. sometimes,37.78548,42.92351,2
Modifications to dataframe in session_state don't persist outside of function?,43.298862,78.5328,2
How to display how much time has passed since a button is pressed,8.535193,38.927143,0
Problem with threading and Microsoft's speech SDK,-32.5756,19.325483,1
Problem with connecting st.button to MongoDB,39.05554,32.836586,0
Can I add an image as part of a tooltip?,24.843836,-21.842205,4
How can I directly use streamlit to create sidebars similar to those in pictures?,-13.468714,-36.03074,9
Checkboxes and remove options from a list,77.580536,33.781853,7
Forgetting session_states and refreshing the page when clicking the app pages,37.959538,61.947174,2
Can we cache library imports?,-0.31642038,74.94663,2
Use st.experimental_singleton for heavy objects,8.865809,65.846085,2
Changing color of a column,38.255642,-30.565195,4
St.form on_click callback uses old values,64.19805,27.812996,5
"""Your App is in the oven"" page stuck",-15.514315,63.350407,1
Open a docx file directly in a new page,-5.6527524,11.399959,6
My streamlit app is just showing please wait,-52.020184,-7.321523,9
St.sidebar.form slows down st.text_input,55.986965,30.550842,5
Submit button on Enter key press,49.82806,32.140476,0
Customise sidebar (specifically for multipage apps),21.989132,21.161308,4
Personalize st.bar_chart,7.533857,-78.51506,3
Working with the annotated_text feature,13.69362,-12.119216,5
How to display with options to select inside button,73.60606,0.67033213,7
Saving a figure to file - Error with QApplication and QObject::startTimer,-57.67293,20.011349,1
Problem in using submit button function - sending a code for email verification,46.600365,36.544445,0
Having Problem of Pyplot Feature on Streamlit,-31.099054,-70.89308,9
Creating PDF of streamlit website,-22.502104,-0.34914076,9
Segy data file scaning,0.45102158,30.38824,6
"Multiple Selectboxes Updating Issue: After changing the input, the data only updates, if the selectbox is clicked twice",90.45215,1.7220058,7
Dynamic selectbox opitions based on the input of text_input,77.68491,5.4887857,7
Make a widget remember its value after it is hidden and shown again in later script runs,57.891777,46.0035,2
Saving radio session state when widget not rendered,54.357296,54.424442,2
How to change the default width of sidebar in version 1.12.0?,42.42946,-7.8589625,4
Converting Streamlit app to PDF,-22.897429,-0.863531,9
Will Streamlit layout and UI become more customizable?,-20.191721,-38.202663,9
Connection between streamlit and google sheets make the app considerably slow,-60.383457,-33.604946,9
Data Frame Column and Row İndex Color Changing Problem in Streamlit,-1.218367,-44.04887,8
Outcome quiz / Troubleshooting manual app,-11.51161,21.123611,5
How can ı use st.columns with st.tabs (Streamlit),-3.0499287,-40.06372,9
Buttons should be bottom aligned by default,49.07584,5.556682,0
Trying to set up a flow with a download or flag at the end,-12.322206,5.6106863,6
Data entered in streamlit form gets lost if tablet running app is closed for a log period of time,-50.277958,-9.289606,9
Need advice on running asyncio in streamlit,-67.91655,15.923081,9
Stop page from reloading after using downloader,-15.778179,10.570623,6
Sending an email consisting of a verification code and verify that e-mail with a countdown clock in streamlit,-60.934544,-19.937849,9
Altair Charts: sorting on the axis,5.197006,-87.956505,3
Advice on formatting research text and/or citation manager integration?,27.780247,3.3880658,4
Streamlit application is cleared after change selection of select-box,-0.66764086,-34.781143,9
"Output of empty columns in streamlit aggrid saved as ""None""",11.457851,-43.72982,9
Pytest + session state = no key storage,36.068886,77.54413,2
Geemap cannot add colorbar!,32.191837,-27.13127,4
Best resources to improve session_state and app flow understanding,38.290607,61.014492,2
Streamlit line chart doesn't recognize number field in Google sheet,-30.170614,-62.579803,3
"Unable to record a screencast Chrome, Firefox",-38.2663,2.665123,1
Incorrect padding,29.968582,-9.891468,4
Go to another page using a button,23.807522,30.843344,0
1.12.1: replacement technique for my debug method?,-9.523462,35.036945,1
St.code with line numbers and line highlighting,3.3527963,15.491856,5
Dependent Selectbox with json nested file,80.87946,3.5717103,7
How to prevent re-loading of streamlit page again and again?,-27.445547,-17.090584,9
User authentication,1.4795038,55.073444,4
Streamlit branding in link previews…,-52.07228,-50.09814,9
Set tab title to something other than “Streamlit”,-5.097649,-24.271933,9
Can’t predict with Keras model,-52.81349,50.89721,1
Cannot install Streamlit,-82.27234,-6.0446625,9
Not getting the contents displayed,13.263433,-1.3361809,1
St.dataframe is unvisable in one of my machine,38.14104,-58.388565,8
Variable update in for cycle,37.27027,54.61952,2
Trick - Simple MultPage,14.109431,29.646503,4
ImportError with Streamlit Sharing,-79.07482,-15.624837,9
Is there a way to quickly show big data based on input from user?,3.2922854,-38.318596,5
Yolov5 on Streamlit,-45.251743,7.9343867,9
Adding an introduction page without using mutiple pages or radio button,17.00193,32.812428,4
Streamlit App not loading,-54.26042,-8.697023,9
Rebooting(clearing memory) of an app on a schedule,11.054969,53.646248,2
Function trigger after change in streamlit upload,-33.433895,-18.553356,9
Accessing session_info in 1.12+,25.15433,66.95496,2
How to load animation from local disk?,-2.1162329,9.413106,2
Display label-like values in DataFrames,32.15452,-59.251503,8
Is it possible to set default tab view for st.tabs?,22.48782,12.718001,4
Scrollbar missing from sidebar in firefox after updating to version 1.12,41.964096,-4.139739,4
How preventing blemishes on the contour plot,-14.634591,-83.34596,3
Create an new table after user clicks on a row of initial table,58.51271,-7.381438,0
How to be included by search engines?,2.5716023,-24.070353,4
St.cache error on np.mgrid,-4.516589,83.54304,1
Error Dissabling Issue,-21.346132,35.986683,1
Validation using streamlit widget,-11.121019,-29.063324,9
Button triggered changes another variable,35.930878,40.13017,0
Allow access to sessionStorage and localStorage,30.302902,65.95005,2
Use local file path to access the file when the app is on the air,-33.270935,60.839153,6
Streamlit Version 1.12 Bug?,-53.616604,-20.462322,9
How to change the color of the st.download button,-15.859601,6.5999937,0
File_uploader Error,-38.641304,75.32168,6
View External Website inside of streamlit app,-35.65924,-31.510138,9
RuntimeError: Data adapters should be mutually exclusive for handling inputs in Streamlit only,-78.282234,-16.280104,9
Streamlit not detecting changes to multipage apps in WSL2,-55.983055,-13.781466,9
Add a download button inside expander,-13.261303,7.4481487,0
Action-driven tooltips,25.58406,-20.78065,4
How to style slider annotations?,83.253365,-35.14196,4
It is necessary to make an adder((,-10.818212,-0.89270514,4
How to download .csv with a hyperlink/cell inside a dataframe,30.860926,-47.30035,8
Content Decoding Error,-45.406303,59.651806,1
Streamlit embedded Microsoft Visio drawings,-42.62428,-47.657814,9
"Help with cache, callbacks or session state",11.593326,80.578094,2
Text is not displaying,13.380529,-1.1979705,5
I upgraded my streamlit version and now contents of my pages folder show up in the side bar,-25.616161,-21.3324,9
Is @st.experimental_memo globally stored?,3.8430939,67.981636,2
Able to set/config default ttl for cache?,9.354032,88.05663,2
Page config error when running a Streamlit script from inside another,-19.650204,-13.979408,9
Getting error while installing package,-75.98593,24.419939,1
Click on st.metric to see a detailed view of the data,39.41868,-38.336006,3
Background color of a plotly chart not taken,-10.015717,-82.20615,3
Centering a text,36.201977,-39.874096,4
Issue with installation,-76.55034,26.291515,1
Access dataframe in another page (multipage app),25.839048,-52.50879,8
I need to generate an animating Heatmap but not working?,-19.35725,-67.36201,3
Streamlit doesn't display pandas data frame,2.0408492,-46.976055,8
"DuplicateWidgetID: There are multiple identical st.button widgets with key='predict' for an image model, please help?",63.0394,54.780716,0
Align different widget across multiple columns,50.390224,-19.33556,4
Gmaps figure is not displaying the direction layer in the streamlit app,-41.735847,-57.0349,9
Logo and App name at the upper left corner,23.607037,19.37489,4
Several different labels and sublabels for axis,8.34662,-89.10406,3
Add features to the datapoints on map using st.map,16.196245,-58.015934,3
DuplicateWidgetID with key='predict' for an image binomial classification problem,63.039352,54.815025,7
HTML table responsiveness error,39.831806,-17.227432,4
How to build a multi language with Streamlit,-55.29464,-31.392763,9
How to use a streamlit site on the smartphone?,-36.428215,-17.974909,9
DuplicateWidgetID with st.button widgets with key='predict' for an image classification problem?,63.0269,54.809544,0
How to create tabs on streamlit that work independently,-5.330065,-24.516306,9
"St.file_uploader ""AttributeError""",-39.10248,75.48094,6
How to add notifications to Streamlit app?,-41.752346,-30.537317,9
Official Documentation Page Not Showing Properly on Safari,-24.41111,4.952842,4
Sidebar not functioning properly in Firefox,43.484104,-4.4536157,4
How to create expanders for multiple columns?,60.4802,-19.205242,4
Trying to put all graphs in a 2 by 2 or 3 by 3,-1.3270234,-75.98539,3
Setting cache TTL,9.329706,88.02666,2
Delete (remove from app screen) Streamlit form (st.form) after feeling,-44.115196,-17.939045,9
How to make upload and download buttons in columns layout style?,54.561314,-12.380727,0
Turn vertical bar chart to horizontal?,4.1617336,-81.85741,3
Question regarding Streamlit maps,-39.15778,-54.831314,9
"Embedding image links in table doesn't show image, saving to HTML does",15.428288,-18.87303,6
Is it possible to display an html file in streamlit?,-25.50049,-30.700329,9
St.set_page_config,9.169489,19.039124,4
Error with using different keys on streamlit form,-61.7188,-15.714029,9
Errors,-27.191158,33.76245,1
Display images one by one with a next button,19.729635,-26.99127,0
Session specific (compressed) log files (or how to know when session ends),28.809727,67.86868,2
The press the button to calculate is not working,35.176357,37.10098,0
Cache on disk working but not on memory,-4.8972187,79.45976,2
Button inside column: Only one button output displayed at a time,55.319035,-11.279247,0
Link to specific section on another page,21.36567,29.542065,4
How to disable pages in streamlit,-25.688347,-18.623455,9
Combo box widget,80.28211,-14.250089,7
Display images along with comment boxes side by side,21.037428,-28.252249,4
"Removing entire header (running animation, main menu, decorator) and footer from static files",6.787827,-0.9079997,4
Help creating this equation and calculate once hit submit,-6.107826,23.566822,5
Closing an app from button click,26.982555,47.010303,0
"Unable to run ""streamlit hello"" or any other python file after installing streamlit latest",-78.533356,-23.347809,9
Support for pydeck custom tile layer,-32.9734,-87.09971,4
Using pyplot and pandas to display a horizontal stacked bar plot,3.1747074,-81.69093,3
Text in st.spinner,7.9480925,6.6313567,5
is there a way to stream m3u8 files using streamlit video?,-32.388725,5.0959744,9
Streamlit to select excel sheet name and pass the selection to dataframe reader,4.991787,-43.909218,8
Nested selectbox in st.form?,81.43562,3.6944463,7
ImportError: cannot import name 'COMError' from '_ctypes' (/usr/local/lib/python3.8/lib-dynload/_ctypes.cpython-38-x86_64-linux-gnu.so),-54.753773,34.491478,1
Streamlit session state timeout,-50.55531,7.233602,9
A few more questions on Multi-Page Apps,14.061572,26.777832,4
Knowing the Active Widget,55.15579,51.58409,4
Column Layout,51.007866,-23.785975,4
Use button to clear multiselect using session_state,97.43697,-2.7848113,7
On_click function assigned to button runs without clicking,36.412663,45.921,0
How to get multiple inputs using same text_input box?,58.36764,15.535913,5
Connection Error: Failed to process a WebSocket message,-79.586105,38.846165,1
Bad Message Format : 'setIn' cannot be called on an ElementNode,-21.684965,26.909012,1
Wanted to create a log of some format that works across all the instances of Streamlit?,-48.92898,17.203583,9
Perspective inside Streamlit,-44.00802,-49.915222,9
Streamlit and SQLite,-26.032732,-7.622277,9
How to disable text input postback on tab,50.91748,27.227936,5
Pass data to app.py,-15.452507,25.747866,1
"Getting a "" NameError: name '_imp' is not defined "" while try to plot plotly chart on streamlit window",-24.625015,-70.928856,3
St.text_area issue,41.801464,8.926231,5
How to add a text inside the image,22.787025,-27.683878,4
Altair Vega compilation different between Streamlit versions,-32.00724,-58.847782,9
How do I make an automatic changing page?,17.734543,36.008568,4
Question about project-structure,-22.292326,40.30047,4
How to keep app run training model although app is closed?,25.624153,53.657707,2
ProgrammingError: SQLite objects created in a thread can only be used in that same thread. The object was created in thread id 14408 and this is thread id 2776,-16.760551,42.8783,1
How to stop spinner when stop clicked?,6.663486,7.6657557,0
Iterate dictionary in streamlit,-28.605276,-24.287134,9
TypeError: metaclass conflict: the metaclass of a derived class must be a (non-strict) subclass of the metaclasses of all its bases,-49.789272,32.58034,1
Numexpr.utils: NumExpr defaulting to 8 threads,-55.345036,22.633724,2
Hide dashboard?,7.449327,48.206284,4
A forum discussion like app using streamlit,-38.67934,-35.75639,9
Possible to make a trading bot app on this?,31.283268,12.847025,4
Form's submit button does not work as expected,46.789978,38.11733,0
Selecting a specific st.tabs tab using hyperlink,22.019188,13.492407,4
How to make a button open a new page,19.715776,32.714798,0
Horizontally align a button within a column,54.463497,-10.70083,0
"How to disable one checkbox, when another checkbox or checkboxes are checked in streamlit?",-28.39218,-20.266348,9
"What to do? - StreamlitAPIException: ""Expected bytes, got a 'int' object""",-71.58352,-47.343143,9
How to update slider values after modification?,78.13192,-30.704039,4
Downloading a Word document returned by function(s),-7.0959067,9.937358,6
How to select a function with a checkbox and run it using a button in Streamlit?,-28.390368,-21.313112,9
Def name():,-15.389653,29.534634,5
Download inputs as a document,-7.29038,7.739401,6
How to disable warning message when starting as Python script,-18.19604,34.41836,1
How to change theme at runtime (without the hamburger menu),7.324276,-3.9203415,4
Save chronometer when reloading the page,16.684593,43.03195,2
Embed form and container one below the other (retain them after page reload) in a single page,66.191925,26.360891,4
Jinja2,-55.35802,30.048117,4
Can we not use callbacks using the st.form_submit_button?,46.365284,42.045807,0
Bokeh plots no longer showing,-48.9847,-73.43495,3
Html doc for xampp,-3.4144335,7.642512,4
Selectbox does not adapt,85.736984,0.97993046,7
Dynamic Container with Active Tabs,23.39358,11.736704,4
Storing dictionary in dataframe cell using one-item list,33.26333,-57.427654,8
How to indent bullet point list items?,26.439241,-10.412323,4
Streamlit vs. Django and React UI,-89.7723,-24.673891,9
Running streamlit from inside a folder causes trouble with environment variables,-68.395676,-18.399492,9
"How to make Graph, Table and Metrics interactive?",9.310638,-65.31353,3
Creating a nicely formatted search field?,27.775629,4.3879905,4
Streamlit pyvis error when displaying large network,-78.431114,-26.451036,9
Dynamically creating new HTML page with uploaded file,14.934152,33.00333,6
How to hide the legend in st.bar_chart?,7.5514245,-78.368164,3
Manually Host File on Streamlit Website and Get URL,-39.166035,-11.382838,9
Buttons running a on-click function during startup and runtime,36.59902,46.22881,0
Using st.sidebar.empty() streamlit application is going into infinite loop,-12.498787,-36.89829,9
What is the technical term for the main window?,2.9070337,9.338571,4
Dynamic checkboxes and dropdowns within a form without clicking on submit button,76.24291,35.60334,7
How to prevent app from re-running before submitting form button,26.294735,46.177002,0
"Streamlit Multipages set default ""wide layout""",-18.03435,-37.124027,9
Messagesize Error,-25.171019,34.02351,1
Comparing current period with previous period,10.819136,-6.3961306,4
"Questionnaire via url, connected to postgresql",-12.416311,20.424097,4
A Question about Button Creation,32.818394,35.219635,0
How to store multiple input values if st.text_input is mentioned twice?,58.251026,15.801942,5
Unable to add two variable values,1.5669695,26.027746,5
Streamlit Reload a page after button click,-27.335682,-17.01993,9
Using st.cache,-1.3179878,85.45997,2
Streamlit Application connection to Microsoft SQL Server,-37.15328,-23.709692,9
Deploy the web application that only works with my local database,-28.261898,57.929607,1
Create custom input user features,56.490437,11.608946,5
Add css class to component,9.160385,-14.268641,4
St.memization_memo ttl question,2.6249545,67.947876,5
How to interact with python?,-16.289448,24.482931,1
Hide the arrow in st.metric,37.510433,-37.062057,4
Multipage: How to import module from different directory,-61.328396,42.316555,4
St.image in sidebar prevents input widgets from working correctly,50.51137,-5.5138035,4
"Display images without ""Fade"" transition!",6.2201977,2.6168509,4
Set default file upload URL,-42.7797,72.533005,6
Unable to install turtle library,-77.114136,23.919363,1
Using markdown to call a page in multipage app?,19.577753,28.43721,4
Getting a 'ModuleNotFoundError' while making absolute imports to modules present in the same directory level via the python script containing the code for Streamlit application,-76.484276,-14.507753,9
Troubleshoot audio error,-31.677065,15.901757,1
App gets stuck in an endless refresh loop,9.086385,56.689457,2
Hyperlinks in gb.configure_column stopped working,33.797165,-44.517174,1
ScatterPlot map (color code),7.423719,-60.78811,3
Issue with conda environment file,-94.599846,-3.350287,1
Is there a way to add/display bloxs in streamlit?,-26.271824,-43.60966,9
Serve streamlit within flask,-87.46748,-23.693764,9
Language list for st.code blocks?,2.912422,14.590534,4
Very high CPU when displaying pandas styler,36.317604,-66.16187,8
Programmatic redirects within multipage apps,17.831352,26.48866,2
Does streamlit work on mainthread?,-48.897717,-25.180792,9
ValueError: The truth value of an array with more than one element is ambiguous. Use a.any() or a.all(),-42.03922,26.721043,1
How to remove the borders of st.expander,67.6928,-19.05628,4
What tools/docs to make clickable network graphs,2.7296255,-64.94533,3
Create rectangle with rounded corners around multiple containers,37.004757,-20.878544,4
How can i download a numpy array as a csv using Streamlit download button?,-38.09104,18.368223,9
Reappering Error: ModuleNotFoundError,-62.590054,33.183712,1
Session State Variables are re-initialized to initial state going through pages,39.001984,71.21554,2
Ways to increase size in of images using st.slider,79.02372,-35.58286,4
St.columns not working on mobile version,57.095654,-27.640749,4
Adjust input text box associated with st.date_input(),28.316177,-84.730064,5
How to display multi level dataset,5.6252694,-37.789482,8
Removing and Reseting Cache,6.6407385,74.96819,2
How to modify deployed app?,-29.77837,55.231453,4
St.form showing old results even when input is cleared. 2nd form is updating based on input in 1st form,63.416054,27.216637,5
Update the Values in FORMS object and Save to Database,65.3508,29.72955,5
Button inside if statement,34.77184,41.4238,0
Multithreading,4.580513,22.97518,2
Multipage app: White space at top of main page,34.394356,-8.316828,4
Bokeh chart doesn't show,-48.790028,-73.674736,3
"Streamlit reset st.radio to default values on ""Next"" button",-17.84107,-22.912512,9
Latex table in streamlit,-8.437924,-39.616016,9
How to structure the file so that i wont get file not found error after deploying,-35.003258,55.425747,6
Issue with st.cache,-3.7263448,83.828445,2
Implement a way to add CSS selector for all widgets,64.870705,40.22567,4
"TypeError: path should be path-like or io.BytesIO, not <class 'NoneType'>",-49.15499,59.82869,1
Hi@Sum (Highlight & Summarize),28.079245,-25.32749,4
Javascript error on using st.table() to display a data frame built using pandas.cut() function,37.00544,-59.373413,8
Session time out,27.057579,74.95867,2
Trouble with Docker,-86.04238,11.315513,1
Save variable defined inside a button,36.2839,40.702133,0
Not able to run 2 streamlit application,-60.36424,-11.133217,9
Is it possible plot 3D Mesh file or to add the VTK/ Pyvista window inline streamlit?,-36.670147,-64.43183,9
Streamlit with sqlalchemy,-74.95349,13.790903,9
St.code syntax highlighting types,3.0527697,15.091766,4
Duplicate Widget ID,63.24654,53.08726,4
Page reloads on every selection of selectbox,90.831055,6.8632317,7
How to keep appending new values to a list without initiating it after each append,54.46427,6.823672,2
"Is it possible to disable the ""Share"" button for security porpuses?",32.816853,54.70404,0
ModuleNotFoundError: No module named 'torchvision',-62.278336,28.633213,1
How do i create a filter based on the input received from a selectbox?,75.84127,8.48928,7
Number input changes its value to previous state when using st.empty(),64.64722,5.157714,5
st.radio(horizontal=True) is not valid?,82.04802,25.323574,5
My streamlit app is restarting every time,-48.439297,-10.43649,9
Host App that reads local Pickle Files,-32.45249,62.749897,6
How well does Streamlit Scale?,-44.367683,-44.676334,9
Prevent deployed streamlit app from being indexed,-63.909084,-1.654586,9
Error using st.cache,-4.0376453,83.44893,1
A few questions about Streamlit and its roadmap,-46.664925,-42.83651,9
Streamlit server consistently failed status checks and potential memory leak,-48.461067,-5.9596334,9
Form submit button not working,46.4631,37.541573,0
"StreamlitAPIException: (""Expected bytes, got a 'int' object"", 'Conversion failed for column xxx with type object')",-71.82317,-47.942425,9
How to use Return range Values from date_input to filter dataframe,32.34844,-77.98024,8
Unzipping,-40.60769,63.84807,4
Streamlit (st.date_input),-8.287686,-55.18444,9
Update value in selectbox in real--time,84.11445,7.895634,7
Creating interactive table with input elements,61.18452,-6.744001,5
Running streamlit with -m option requires `run` keyword,-61.050255,-12.198349,9
